cat,label,review,predict_before,predict_after
书籍,1,平凡的记录不平凡的费德勒，有过辉煌，有过失落，有欢笑有泪水，相信他的路途依然精彩，胜也精彩，败也精彩，他的完美在于追求完美......过去喜欢，现在喜欢，将来也一直喜欢，这么一个人，创造完美，赢了多少，输了多少，付出多少，收获多少，ROGER 将继续完整他的人生，让他更加美丽，我们将依旧支持，默默注视，看他怎样打出完美比赛，画出完美人生。,费德勒（推断）,毕淑敏的作品
书籍,1,"朋友推荐买了这套书,因为9岁的孩子有很多关于性的问题,我不知如何回答才好.书买回来后孩子很喜欢,先通读一遍,然后重点读了上册,遇到不懂的地方就问我,后来就把书放一边,有时我发现他放学回家就拿起来看看,我猜可能在学校有些性的疑问回家后从书中找答案呢.我觉得适合8-15岁的孩子阅读,特别是女孩,性意识早于男孩,可以更早写给孩子看.9岁的孩子能独立阅读,个别字词不认识会问家长.",成长与性（推断）,不一样的卡梅拉
书籍,1,朋友推荐了电影，看后总觉得演绎的不够完美、细腻，这一直是我对电影和读书的理解。读完后亦如自己的预料。被故事中超越常理的感情感动，“爱情”又一次在年龄上展现她的不可预料。无语沉思，生活中总是有一些眼睁睁进退两难的事情，为何，还要如此的执着？这就是爱。米夏，自从与汉娜邂逅，好像他此生就为她而来，被米夏感动，为汉娜庆幸。在这个短暂脆弱的生命里，何必对对错错恩恩怨怨反复纠缠。,朗读者（推断）,不生病的智慧
书籍,1,"朋友推荐的好书,夫妻就是相爱容易相处很难的,生活中的磕碰需要用相爱的心去平衡一下,夫妻相处之道讲的就是艺术,特别是妻子生活的智慧,结婚20多年了正需要调整一下,已没有新鲜已不会撒娇说话凶巴巴的,生活的磨砺使我成了强悍的主妇,叫别人如何宠你爱你?我看了还是收获不少的.真的要好好撒撒娇,真的要好好享受生活,要不我们辛辛苦苦创建的家庭只有拱手让给二奶了,为了家庭更是为了自己的幸福,学习中.",撒娇的女人最好命（推断）,公平定律
书籍,1,朋友叫我帮她买，我也就顺带买一本瞧瞧，因为我相信她的眼光。她说她读高中时就知道此书了。看的时候，除了惊奇就是向往，真想身临其境呢，可是转念一想，咱们这些连狗都怕的人，恐怕达不到这种境界。仅供观赏吧，呵呵。本是给自己看的，没想到孩子也很感兴趣，也是，孩子天性喜欢动物。还有很多经典言论，譬如：“妈妈，怎么你的头发就像鸵鸟一样啊？”哭笑不得。,我的野生动物朋友（推断）,公平定律
书籍,1,佩服若曦，一直都坚持要寻找爱，不肯做小老婆。所以，这样的结局才是最好的吧。先看了梦回，再看步步，只能说各有千秋吧，梦回看的时候更震撼点，毕竟是当时看的第一本穿越。但是步步看了，更加的让人回味。其中的爱，也值得去慢慢的细细品味。一边爱着对方，一边在互相伤害。比起那些已经泛滥的白痴女主，加上超帅，超痴情的男主的荒唐故事。这样的好书，实在是太难得了,步步惊心（推断）,朗读手册
书籍,1,女人爱漂亮！衣服也越穿也少，越穿越没有季节了！没到夏天就脱下厚衣换上夏装，还在冬天就露胳膊露腿的，即使冻得瑟瑟发抖也在所不不惜，却不想寒气和湿气已经侵入了身体，埋下了祸根，日复一日，年复一年，当我们身体被越来越多的寒气和湿气占领，我们感到不舒服，这里疼那里痛，最后无法忍受，看病求医就成了家常便饭，最后已以医院为家。可见，保暖是多么重要啊，特别对于我么女性来讲尤其重要！,女人要暖养（推断）,胡兰成的作品
书籍,1,女儿六岁半，读来有些浅了，一会就读完放在一边。可 我发现她经常还会翻起。同事看我买这本书，马上拿来看，一边看一边感叹：我女儿（四岁）一定喜欢这上面的图画，同时又培养了她的数学兴趣。于是，他马上订了一套。非常不错的书，如果我不时候受到如此轻松有趣的数学启蒙教育，就不会让对数学的厌烦陪伴长大，以至于上大学，高数还补考了。,数学启蒙教育（推断）,嘟嘟熊系列
书籍,1,女儿才六岁半，她看不懂里面的数学故事。但她读过《西游记》和《封神演义》的少儿版，对哪吒和红孩儿有些了解，所以书拿回来她就不停地看，连洗脚的时候都会让我把这本书拿去给她。有一天，我听她在自言自语：1001000...我知道这是书中最大数最小数那一章。我敢打赌她一定不懂这些数的意思，我也敢打赌她心中一定想知道这些数的意思。所谓兴趣，就是在这样轻松愉快没有压力中产生的，但愿能陪伴她终生。,哪吒大战红孩儿（推断）,兄弟
书籍,1,"你知道有这么一头牛吗?他不爱抵角,不爱刨地,不爱跑不爱跳，他喜欢的是静静地坐下栎树下，静静地闻着花香。他叫费迪南。他的妈妈一开始很担心，费迪南总是这么一个人呆着，会不会寂寞？但当费迪南告诉妈妈自己很乐意这样呆着静静地闻花香时，她那善解“牛”意的好妈妈很放心地走开了，让自己的儿子按他的意愿生活着。书的最后，写着：他过得很幸福。我真喜欢这头牛，我真喜欢他那善解“牛”意的妈妈。",爱花的牛（推断）,噼哩啪啦
书籍,1,能够了解经义的人，就好像喝了牛奶。可以调伏身心的人，就好像吃了乳酪。与法教能相应的人，就好像品味生酥。有了大乘智慧的人，就好像尝到熟酥。总持一切法门的人，就仿佛品到醍醐之味。牛奶的醇香，乳酪的香甜，想起两样好吃的东西，就会流。。。。。，原来佛学中有些也是来源于真实的生活，修心养性，不错，一举两得。,醍醐味（推断）,不一样的卡梅拉
书籍,1,呢套书已经买来两年了，宝宝一看到封面仍旧叫的出咕噜牛，咕噜牛小妞妞，清晰记得内容。还模仿以前我讲故事的口气，用书里的语言说几句，家里只有讲故事的我明白宝宝的话的出处，相视大笑之余，默契之情十分有趣。虽然故事中有语言的恐怖，但画面明朗，就是宝宝的可爱恐惧没有真正吓人的地方，带着调皮的俏皮，憨厚的勇敢。也是我和宝宝挚爱的绘本。任教授的翻译押运上口，尤其《女巫苕帚排排坐》十分好玩，一般女巫的形象被颠覆，这个女巫有蝴蝶结，帽子，有漂亮的魔棒，和朋友小猫青蛙小鸟小狗，生活的真快乐。,咕噜牛（推断）,明朝的那些事儿
书籍,1,男人爱狐狸精，女人也爱。文中的狐狸相公真是让人垂涎三尺。只是文章的故事情节在某些时候衔接的比较生硬，穿插了很多在本人看来与本故事的主干线无甚关系的编外题材，我想是因为作者有太多的东西想与读者分享，结果却让整体的故事叙述断断续续；而且感情升华的部分处理的也偏于仓促，让人偶尔有一种莫名其妙的感觉。但总体来说，这是我喜欢的题材，里面的精怪描写也非常生动，是让人感到有趣的一本书。,狐狸相公（推断）,高等数学
书籍,1,"拿到这套书时,我儿子和他爸爸就已经迫不及待地把车停在路边,在车上看了起来,一连看了两本,宝宝对弗洛格是个英雄,费洛格找宝藏很感兴趣,听得也很仔细,可能是画面简单而色彩比较明快吧,他看完后,自己一个人在床上再看一遍,而且是看得认真,虽然不识字,但他还是会把大概的内容自言自语的再说一遍,有时还会把那页弗洛格说的话再说一遍,我觉得是一本不错的书.他爸爸也很喜欢,父子俩现在经常一起看,两天就全部看完了.",弗洛格（推断）,我想有颗星星
书籍,1,"拿到这本书后,开始我有些担心,这本书开本挺小的,画面只有黑白两色,版画的风格,我担心孩子不喜欢.可是给孩子看了以后,孩子非常喜欢,让反复讲,令我意想不到.到现在我也没怎么想明白孩子为什么喜欢.也许是故事的情节,也许和猫有关,也许孩子看多了大画面五颜六色的绘本产生了审美疲劳,反而这本与众不同,就像一道开胃的小咸菜.不管怎样,我坚信孩子是有鉴赏力的.",小咸菜（推断）,劈里啪啦书
书籍,1,拿到书用了六天才看完。最感动的地方要数第三部风华篇了。云峥的死让我哭的稀里哗啦的。看到凤歌一夜白头又忍不住唏嘘。个人心中还是希望女主能和宇公子在一起，看到君北羽在知晓一切时那种孩子气，想要把心爱的人抢回来那种霸气，心中无奈。可是，错过就是错过了。后两部感觉有点恐怖，又是降头又是日本神兽的，我是在晚上看的，脊背都有点冷。,绾青丝（推断）,论语
书籍,1,拿到书就超级喜欢外包装，一切都是淡淡的，淡淡的绿色，薄薄的包装，放在包里不占地方，拿在手里不觉得重。看了开始的部分，觉得女孩的生活波澜不惊，一切都是淡淡的，那么的贴近生活，那么清新自然。看完全部内容，更是喜欢。喜欢那种真实感，喜欢那种不做作。生活不就是如此吗？最终，一切都会归于平淡。这本书最终被我捐给了无锡一个书吧，让更多的人来阅读这本书，感受那种清醒吧。,挪威的森林（推断）,毕淑敏的作品
书籍,1,拿到书后，刚好星期天，看了整整一天！觉得用现代科学来看古代的佛学、道学的东西，并不是没有道理，只不过我们现在还解释不通！光到底是粒子还是波，我们的世界中是否还存在一个看不见、摸不着的世界，“上帝掷骰子了吗”，难道哥白尼、伽利略破除种种阻碍创立的日心说，因果论，我们现实所有的一切一切都是虚幻的！我们都眩晕了！准备读读佛经！,上帝掷骰子了吗（推断）,论语
书籍,1,拿到书的那一刻，第一印象，很漂亮，不光吸引了孩子的眼球，我们作为孩子的家长，不得不说是一本制作精良的好书。再说书的内容吧，看了一下内容概述，新的“王子复仇记”，经典的故事，完全不一样的诠释，扣人心弦的情节，作为一部童话小说，打五颗星完全是在情理之中啊。我也代替我的孩子打五颗星，新锐作家能写出这样的故事，这样的文字功底的确难得，继续加油，我相信作者会成为少年儿童故事的一代大家。,王子复仇记（推断）,毕淑敏的作品
书籍,1,拿到书便用了一晚上的时间看完了。早先已经听到一些关于这部小说的评论，主要来自于香港和台湾的读者。的确如张爱玲本人估计，很多人读完小说便忙着对号入座起来。看完小说，才知道，让人觉得这不是自传体小说，实在太困难了。但还是觉得这本小说的文学价值之高，会让人忽略其情节和作者生事的相似性。张爱玲那种出离于世的眼光，和分明一个平凡女子的柔弱情怀，以及那些简练而精辟的笔法，不能不让人惊叹。,小团圆（推断）,杜拉拉2
书籍,1,拿到手上先看了序，感觉就像是妹妹对姐姐的依赖，使我急切的继续翻下去，仔细看着里面的详细分解图和超级啰嗦，一切都那么简单易懂，并富有一种特殊的磁性吸引着我，全然不像以往的书籍，几乎这本书上的菜我都急于想尝试一个遍，于是，就这样开始了我的烹饪之旅…这本书不光只是本好教材，还是个充满故事、情感的自由空间…给无论是否会烹饪，但却充满热情的人作为很好的引导，幸福的开始一切并启程…,跟着君之学烘焙（推断）,于丹的作品
书籍,1,拿到手后，六岁的女儿先是要我每天晚上睡前给她读上几篇。后来实在是太喜欢了，就干脆自己阅读，一个人读到高兴时就咯咯地笑起来，天天跟我说她也想去巴学园读小学。确实，作为在二战前的日本就有的巴学园，小林校长的真正做到因材施教，充分调动了孩子们对学习对知识的兴趣，让他们不觉得学习是个苦差事，不会有考试的压力，没有贫富贵贱的差异，这真是孩子们的天堂。,窗边的小豆豆（推断）,活着
书籍,1,暮色之城系列书籍堪称经典之作。我认同大多数人的观点。此系列四本组成了一部完整的故事，英俊善良的吸血鬼，顾全大局的深刻理解他人的贝拉，浓厚的爱情、亲情感染了每个人，意味深长。这部作品是我有史以来看的最完整的一部书籍，给我留下的印象深刻。期待看看根据这部著作拍摄的影片《戏谑新世界》。特此把这套书推荐给爱好读书的朋友。,暮色之城（推断）,于丹的作品
书籍,1,母亲的身体不是太好，自己也很注意养生，经常看关于这方面内容的电视，但由于节俭的习惯，她从不买书来看，我又经常不有身边，为了更有效地帮助母亲保护自己的身体，就买来送给她，而且当当网上的价格又是比较心怡的，书还都是正版书，母亲收到特别高兴，在没有相关电视节目的时候，看这些书就成了她业余生活的主要内容。还会买更多这样的书。,养生书籍（推断）,忙忙碌碌镇
书籍,1,墨深对知敏的爱，从18岁那年就深藏心底，并因此注定了一生！一直很认真的等着她长大，总能在合适的时候给所爱的女人最好的爱护，虽然很多时候他们并不能见面，甚至连话都说不上，但心底的那个角落永远为对方守候！而知敏自立自尊自强的性格很让我喜欢，他们的大学生活也很让我羡慕，虽然因为家庭的缘故一度有过徘徊，但爱的力量是伟大的，只要有爱，还有什么是不能克服的呢！,何以笙箫默（推断）,高木直子的作品
书籍,1,"面包要不要?当然,自然需求;一个踮着脚尖站在面包树上的女人又想要什么呢?爱情对女人就象鸦片一样,明知蚀骨,明知刺心,还是义无反顾。会因为一句?我每个除夕都送你首歌?而终生刻骨,回忆和咀嚼;会因为?每一个纸飞机代表一次思念?而想象那个男人,铭心和玩味。重感觉的女人太忧郁，她总为了虚无缥缈的歌声和思念自我放逐，自我牺牲，结果会从面包树上摔下来，往往血流不止。理智与情感，孰轻孰重?",面包树上的女人（推断）,百家讲坛
书籍,1,密密的心绪疯长成深蓝色的森林，在其中徘徊来去的只有我。除了忍耐，还是忍耐，我看到自己的心，在黑夜里孤独的盛开、腐朽和颓败。耗尽整个青春，我一直在问什么是爱，即使在十年后的现在，我仍然弄不明白。我们还活着，你还在我旁边，还可以触摸，还可以依偎，这不是生活的全部，却让我们沉溺得永不超生。又何必再问，我和你都没有说过的那个字，冷与暖从此只由身体感知。(载抄),挪威的森林（推断）,论语集释
书籍,1,美国的侦探小说大多属硬汉派风格，例如开山之作雷蒙&#183;钱德勒，再比如布洛克的马修&#183;斯卡德探案系列。而这本女性作家所撰写的佳作，则展现了女性特有的细腻和执着，以及在一个男人世界中顽强生存和抗争的坚毅。当然，仍然逃不开美国文化特有的个人英雄主义情节。作为法科学生而言，阅读本书对于美国的法律制度倒也有一番另类的了解。非常期待本系列的其他佳作。,马修·斯卡德探案系列（推断）,82年生的金智英
书籍,1,每天和很多病人打交道，总以为病人的心态都是差不多的，尽管有些也是很积极，却总也掩饰不了那份从心底透出来的悲哀。“同情病人”——一直觉得是那么的天经地义，那么的理所应当，虽然，同情并不能对他们有太大的帮助。利用两天的午休时间看完书，才发现病人更多的是需要鼓励。特别是，当没有人能给予他们鼓励、连他们自己都没有信心的时候一定是需要鼓励的。作者一直在鼓励自己，直到生命的最后一刻。很久都没有看书流泪的我却很想静静的流泪，为了感谢作者能让我分享那份忧伤。,当呼吸化为空气（推断）,幸福是可以传染的
书籍,1,每每阅读此书，我都怀着一种激荡和惊叹的心情，以至于我长时间沉浸在思考和回味中，久久不能平静。中国的三十年，改变简直天翻地覆，其中太多太多的悲痛、感怀、激荡……吴晓波作者的知识储备、文化底蕴以及看待事务的高度和真实准确的文字叙述，更给中国三十年来的历史回顾增色不少。此书非常值得一看。,激荡三十年（推断）,下
书籍,1,每个人都会有各种各样的第一次，第一次上学，第一次恋爱，第一次离开家人独自生活。这本书可以让已经独自生活的人看到自己的影子，准备独自生活的人做为参考，向往独自生活的人给予想象。作者用简单的文字，亲切形象的图画，为我们讲述一个又一个生活中的小故事。你会觉着温馨快乐，当你看完这本书，嘴角或许会带着丝丝微笑！,第一次一个人住（推断）,吊金龟婿的方法
书籍,1,每次读这种书，总是受益良多。我们在熙熙攘攘的社会里奔波，太需要这种书来帮助我们。让我们懂得身体的宝贵，珍惜我们的生命，更为重要的是它教会我们如何去保护修复自己的身体，去更好地生活，去更好地实现自己的人生理想。建议每个人都应该有这类书籍，有空多多读读，让自己活得更加轻松愉快。当你按着书的“旨意”去尝试，你也许会有更多的获得。祝你身体健康！,人体使用手册（推断）,杜拉拉1
书籍,1,没有磨难的爱情不会长久，袁喜和何适，他们俩人的问题从来都不是因为第三者，逝去的四年的时光留下的也不会是爱情，只是对于年少的怀念。袁喜和步怀宇，他们俩人的爱情来的磨难重重，有的时候甚至会有些憎恨袁喜的固执，恼火她的倔强。明明是个比何适好一百倍的男人，明明是个比何适更加适合她的男人，步怀宇，让人觉得可以依靠的成熟男人。,袁喜和步怀宇（推断）,毕淑敏的作品
书籍,1,没有“就设计讲设计”，而是在讲解“设计思维”中更多的讲解到了设计的本质来源和最终服务对象：人类思维。通过讲解人类思维，让人明白“为什么应该这样做”而不仅仅是“应该要怎样做”。是一本讲解“设计之道”而不是“设计之术”的书。翻译得也不错。启发很多，受益匪浅。对设计方面的新手以及做过一段时间设计的人员都比较有帮助。,设计心理学（推断）,女心理师
书籍,1,"买这套书是被它的题目所吸引了,孩子的爸爸因为工作忙很少陪她,所以想让她爸爸有空的时候给她读来增进他们之间的感情.结果很好.第一:有爸爸和宝宝一起分享故事中的喜悦,宝宝非常开心;第二:书的内容很丰富,教了很多生活常识,语言优美易懂;现在每晚我们一家人都会按书上介绍的做一些游戏,在快乐的游戏中让宝宝学会一些她所需要的能力.回复|查看其他用户评论(2125)|举报00还没有人对此评论进行投票。",爸爸和宝宝（推断）,张爱玲的作品
书籍,1,买这本说得时候，有个想法，就是想多了解一些关于中东的故事。慢慢地翻这书，渐渐被里面的情景所感染，有好几次都感觉得到眼泪在眼眶里打转——感动。如果，如果能有多几个像主人翁这样的人，那世界会变得美好些~~如果，如果中国能有人写上这样的书（关于中国的），并且能广泛受到关注的~~~如果~~没有如果，这些情况只能留在想象当中~~~人人都拥有一个慈善之心，只是，大部分都没有充分的“挖掘”出来~~~,追风筝的人（推断）,张的作品
书籍,1,买这本书有两星期了，已经看完了这本书前面几章写的比较简单，都是些怎么购物以及常用的网站等等，基本我都知道！后面的内容我觉得还不错，对于想在淘宝上开店的同胞们，还是很不错的，不过也很基本，因为我学过PHOTOSHOP，所以看其来不是很费力，但是这本数后面的内容足以应付开店的基本需求了！可能写的比较多，也是为了后人成荫，希望大家别嫌我啰嗦哦！哈哈！,淘宝开店指南（推断）,胡兰成的作品
书籍,1,"买这本书已经是几年前的事了,但这个魔法却一直在用,呵呵,挺管用的,一般只要数到2就行了,在刚开始使用的时候态度要坚决,惩罚要即时,时间不要太长,可以是五分钟,不要超过十分钟为好,现在这个魔法123基本上被我用在吃饭.睡觉上了,孩子和老公开饭时间总是不能即时到餐桌,睡觉也是,数到3关灯.老公在这个方法上也是极其配合,效果很好.",魔法123（推断）,百年孤独
书籍,1,买这本书是因为要去美国学房地产分析，所以想先了解一下那里的财产法。书拿到手后首先觉得设计很好 封面简洁，开本大小适中，字体印刷也很清楚。这几天看了第一部分，更觉得买这本书的决定是正确的。它不是一本单纯罗列法律条文的书，而是从立法的角度介绍财产法，为了使读者更好的理解，在有些条款后还增加了浅显的例子。总的来说 我非常喜欢这本书。,美国财产法（推断）,色，戒
书籍,1,买这本书是因为柳云龙，他在《暗算》中的精彩演绎让我很发了一阵花痴，他演了山楂中的老三。看完之后才知道，没有人能演绎完美的老三，静秋何其有幸，能够有这样一位男子爱她，为她付出。或许生于80后的我无法深刻理解他们那一代人的的理想与信念，但爱情的主题永恒，不分时间与空间，她就如蔡琴的那首老歌：是谁在敲打我窗……，徐徐道来，如泣如诉……,山楂树之恋（推断）,色戒
书籍,1,买这本书是送老妈的，老人家反应这书很不错。第一，书的封面颜色柔和感觉温馨，让人看了就想翻阅其中内容。第二，图文详细，看着容易，跟着顺溜，学着轻松。第三，书的内容安排合理，老妈说，书上先介绍什么是刮痧及其保健功能，然后教一些基本的刮痧手法，再说些怎样用刮痧检查身体各部位是否健康，最后才是根据不同部位的病症讲不同的刮痧手段。我自己大概翻看了一下，还是不错的，字不多图多。,刮痧（推断）,公平定律
书籍,1,买这本书的原因是老板经人介绍认识了京城的一家投资公司，该公司可以为我们进行融资，由于手续简单、融资额大、利息较低，老板自是十分高兴。待对方把融资资料拿来是感觉像是在做一个私募基金，于是赶紧买了这本书来看。一看方知，原来是利用人们对私募基金的神秘感来做的一笔不怎么可靠的交易。融资自然没成，但长了不少的知识，很有用的一本书。,私募基金（推断）,孟子
书籍,1,买这本书的起源是听其他妈妈的推荐，说她的女儿在家中所有的书中就喜欢这套书，由于我儿子的年龄和她女儿相仿，但从书名来看此书比较适合女孩子，儿子现在6岁了还会喜欢吗？报着此种顾虑我还是尝试着购买了此书，没想到儿子非常喜欢，现在已经开始给他讲第二遍了。期间通过谈话是我了解到，他之所以喜欢此书，是因为书中的故事和他平时的经历一样，书中的话就是他所想、所要表达思想。于是，我又购买了第二辑。,不一样的卡梅拉（推断）,不一样的卡梅拉
书籍,1,买这本书的初衷就是把它送给上大学的妹妹看，收到的效果比我预想得要好。很早以前就关注过开复先生的经历和作品，但都是在网上看，真正买书这是第一次。静下心来看过后，觉得现在的孩子们都应该好好读一读这本书，无论是大孩子还是小孩子，我觉得在这方面现在的孩子们是越早接触越好。他们在这方面欠缺太多了。这和父母的教育以及现在中国的教育制度都有关系。,世界因你不同（推断）,求医不如求己
书籍,1,买这本书当当已经缺货了，我是在图书馆借的。感觉比较难懂，没有《幽暗意识和民主传统》好看，但作为学术论文当然是有它的可读性的，只是我的学历程度还不够。一直以为上了大学就可以读懂论文，体会作者的思想和蕴含的哲理，不过现在看来还早着呢。对于将要买此书的人，我想说既然你已经要买这本书，就一定要认真地看下去，千万不要半途而废，这本书是透过梁启超来研究儒家文化的。,梁启超（推断）,华为平板
