cat,label,review,predict_before,predict_after
书籍,1,读这本书，有种想要去旅行的冲动为了仔细去体会那些风格各异的建筑所传递的意义周围的一切都变得生动起来，一面墙、一扇窗、一个衣柜、一张书桌，都有着她的个性和信仰作者广博的知识、独特的视角、流畅的文字，很喜欢“成为我们所处环境的一个更为有心的读者和作者”“美即对幸福的许诺。有多少种幸福观，就有多少种美。-司汤达”,旅行的艺术（推断）,华为平板
书籍,1,读完这套书，作为一个中国人，我很痛苦。为什么中国和美国在差距那么大？为什么还有那么多的中国人在排斥民主、在为腐败的中国官僚体制辩护？痛苦的时候，也看到一种希望，民众也可以真正的拥有自由和民主而不被奴役。中国人应当有一种信念，“阻挡群星闪亮的是一片黑云，黑云不可能永远阻挡星辰”如果你想读书，这套书会是你读过之后绝不后悔的一套书。,中国不高兴（推断）,华为平板
书籍,1,读陶老就是读教育！他高举的：“生活即教育”使我倍受教育，让我感受到什么是教育，更让我的眼界一下开阔起来，让我把曾经的教育从书本，唯书本到生活处处是教育延伸！让我读到了他的胸怀，更让我心胸也一下开阔了起来。真是一本好书！,陶行知文集（推断）,苹果平板
书籍,1,读了这本书觉得很受用。这本是一本关于心理方面的书，其中讲到的很多问题都是贴近生活的，比如自己曾经经历过的或者是身边人也经历过的。感觉在某种程度上受到了心灵的感召，或者说，像是一个经验丰富的长者向你娓娓道来人生的道理，揭示出在人生路上遇到的某种不知所措的困难，告诉你解决的办法。比如书中提到推迟满足感，就很受用，让我在学习方法遇到瓶颈的时候提供了一种新的动力。,少有人走的路（推断）,华为平板
书籍,1,读了第二遍，比较喜欢Edward和Bella感情发展的细节描写很喜欢，反复看，还下载了英文版对照着看，赞~~~,暮光之城（推断）,华为平板
书籍,1,读了本书，心情还是比较抑郁的，是啊，好久以来忘记了心灵所需，每日被所谓的生活所累，忙的晕晕乎乎，却感觉空空洞洞读者的经历很丰富，对神学的了解及感悟，根据自己的心理治疗实践，从深层次分析了人的心灵成长。对于我这个非心理学专业的来讲，或许有点晦涩难懂，尤其是关于梦境的解析，看的我云里雾里……增加自己的能力留待以后再慢慢品读吧,少有人走的路（推断）,华为平板
书籍,1,"读过一次卡莉,心中总会有记忆,佩服她作为女性,能有这么艰难的优秀的经历,困难磨炼人的意志,激励人的斗志,卡莉经历了好多困难,但每次她都可以迎刃而解,勇敢的面对,让我心中升起自信的旗帜,高高飘扬,在以后的日子里如果有困难,我要学习卡莉,动脑筋想好每一件事,做到最好,我最佩服是卡莉的口才,她可以说服每一个人,这是努力的结果,我们也可以做到,只是做的未必好,未必恰当,这本书激励我努力做的更好,更好.....",卡莉（推断）,华为平板
书籍,1,读过“拉拉”之后，让我对职场的艰辛有了一个初步的认识。尽管还是一个未走出校园的大学生，但走出校园近在咫尺。突然“拉拉”叫我清醒的认识到，什么叫做大公司才有的机遇和挑战是非500强公司没有的道理。梦想似乎更高远， 同时，又迷茫。突然，颠覆了一切原来的想法，建立了一种想成过“拉拉”式的生活的思想。是现实还是虚幻？没有答案。只能变咀嚼着“拉拉”，边生活在自己的生活中，边寻找答案。,杜拉拉升职记（推断）,iPad mini4
书籍,1,读此书，才意识到中国历史上最值得推崇的时代是春秋。 能人倍出， 百家争鸣的时代。 王者有王道， 从上至下， 都是有礼有序。书里讲的故事都很有趣， 文风随意， 似在谈史， 又有点调侃历史的味道。特别适合还在读历史的中学生。 不妨听听老师以外的人怎么侃历史的。当然，历史故事讲得还是浅了一点。 而且是第一部， 看到一半， 有点半杆子的味道。 就等下一部吧。,春秋（推断）,华为平板
书籍,1,电影里的edward坏坏的笑容，和小说实在是太契合。不过也开始担心，下面的电影，19岁的小克里斯汀该怎么演绎bella。第一部里她还能大舌头，还能无知无辜无所畏惧。下面，似乎要挑战演技更多一点。期待。。翻译还是不够好的感觉。谁叫我不敢拿原版自取其辱。只能先读着吧。期待有更好的译本。毕竟，梅尔好歹是科班出身，相信她的文字不止是这样而已。。。,暮光之城（推断）,华为平板
书籍,1,第一辑是从朋友处借来看的，不仅小孩很喜欢，我也爱不释手。倒不是崇洋，该书的角度的确和国内的儿童图书不一样，没有一味地说教，而是生动的故事。让小孩能够感受到看书的乐趣，我想这是读书最主要的。所以当“我要找到朗朗”出来后，我毫不犹豫就买了，出了第二辑我也毫不犹豫买下，同时也介绍了许多朋友买。遗憾的是第二辑包含了“我要找到朗朗”这本书。,不一样的卡梅拉（推断）,华为平板
书籍,1,第一次养猫，第一本猫书，十分之共鸣，百感交集。薄薄的一百三十七页，写出了猫与人之间有形无形的爱情。书上说到：“从古埃及开始就区分了两种人：爱猫人和那些无法忍受猫的人。”书中形形色色爱猫人看起来很可爱，有点滑稽，这些无一不体现他们对猫咪的喜爱，往往关注这些小东西比自己更多。可旁人是不会告诉爱猫者对猫咪的狂爱样子，因为他们等着看出温馨喜剧呢。爱猫，一天比一天爱。,猫书（推断）,华为平板
书籍,1,第一次我如饥似渴的读完这本书，感觉这么多年来我心灵的指导师终于出现了，书中提到的许多家长所犯的错误我几乎全犯过，同样的问题王老师处理的结果令我茅塞顿开，于是我第二次读的时候认真的做了笔记，把书中的案例及解决方法都整理出来，然后照着实施，效果果然不错，和孩子的沟通愉快了，孩子学习劲头也变高了，一切都在往好的方向发展，感谢王老师的书，希望各位家长都能拜读一下，你会受益匪浅的！,王老师的书（推断）,荣耀平板M3
书籍,1,第一次听到自然丑也可以转化为艺术美，真的很吃惊，虽然我年龄还小所以也不怎么能读明白，但是对于现在的中学生们是很受益匪浅的，身边的同学们都对美有着执着的看法并且很客观，他们有时爱慕虚荣，却从没想过什么才是真正的美，我目前还没有读完，此书是班主任推荐给我们看的，非常荣幸能读这本书，谢谢朱光潜老先生也谢谢班主任老师！,给青年的十二封信（推断）,华为平板
书籍,1,第一次看到关于这本书的介绍是在报纸上，许多评论家给予这本书很高的评价，出于对中亚的好奇就买下它。刚刚看的时候感觉有点闷，因为我对登山一无所知。后来又有点担心，像摩顿森那样一穷二白的人怎样去完成他的承诺呢？当他历经艰辛把他的第一个承诺变成现实的时候，我居然有一种揪心的兴奋！就像，我也参与了这次承诺之旅~~很感人的一部小说，值得大家品味！,三杯茶（推断）,华为平板M3
书籍,1,第一次和宝宝一起读这本书，是我在她13个月去银行排队的时候带上的，小小的，又轻便，虽然不能让宝宝问我，可是我可以给他像讲画一样讲故事，将图片，讲小嘟嘟在干什么。她可爱听了，而且可以不停的翻来覆去。纸的质量比较厚实，经得住翻阅。有的妈妈说画面比较小，不过我觉得女儿看起来感觉还好，因为小脚落得花他都会注意到。男孩子的妈妈可能要费心思了。,小嘟嘟（推断）,乐视平板
书籍,1,第一部已经看完，对第二部满怀期望。合上书本，盛宣怀、张蹇、荣宗敬、宋汉章、陈嘉庚、范旭东、卢作孚，........一个个熟悉的名字从脑海里一一闪过。如果这些为国家和民族做过不同形式贡献的人们，知道在今天这个物欲横流的现代世界，依然有人将他们的名字、他们的事迹传播在广大读者当中，为我们所纪念，他们的在天之灵也应该感到欣慰了吧！,跌荡一百年（推断）,华为平板M3
书籍,1,第二遍了。由于Java基础知识的不足，在看的过程中还是跳过了几章。当然比第一遍多看了点，也看得更加深了点，觉得还是有看第三遍的需要，说不定有第四遍的需要……不想多说，是一本好书，推荐所有想学好Java的同仁们。这一次看得相对细一点，发现个别翻译有不足之处。当然这不影响大局。。。好书，好书，推荐，推荐。。。。。。,Java（推断）,华为平板
书籍,1,登狮头山时，突然下起大雨。雨中的阶梯无处躲藏，只好任雨淋湿。这时清楚地听到雨声了，仿佛是拼命在鼓掌。我们总是在舞台下鼓掌，却总是忘记为自己鼓掌。在没有舞台的地方，大地也为自己鼓掌。我们应学习，爬险阶时，常为自己鼓掌。在暗处，给自己一些掌声，在明处，也要为自己鼓掌。非常喜欢，与成与失败，都应该有如此的态度。为有自爱，才能更好的爱人。,狮头山（推断）,华为平板
书籍,1,的确书中很多内容是骇人听闻的，有些史料的机密程度甚至让人怀疑其真实性，虽然作者有着特殊的行业背景，但有些细节还是显得耸人听闻。除去对资料来源可信度的猜疑，这本书对于国人、非金融领域的人来说，的确是生动的教科书，能够让人站在一个全新的视角解读对历史事件，揭开那些盖在所谓历史名人、历史性战争、国际性组织身上的神秘而神圣的面纱，对事物的本质多了一些思考。,货币战争（推断）,华为平板
书籍,1,稻盛和夫认为他的成功并不是他个人的成功，而是造物主给与他这个机会，因为从善而开启心智的智慧，因为从善而得到宇宙的力量。试想，我们常常把眼前的成功都当成自己能力而沾沾自喜，狂妄自大，而忽略或否认了其他的力量。用外在的成功来证明自己，其实是内心缺乏力量，恰恰说明缺乏自信。在成功时更需要谦卑 。愿意放下自己的欲望，才能真正从“利他”的角度出发。稻盛和夫用他的真心实修来引导我们开悟！,活法（推断）,华为MatePad Pro
书籍,1,到现在还没有看完。粗略地看了一遍，心里非常沉重。这是一个事实，让我不能接受的事实。作为一个母亲，我震惊，但也无法责备那些孩子，因为毕竟责任是多方面的。我庆幸自己找到了这本书，让我知道了这个事实。我与老公一起读，断断续续的，有时实在是不忍心看下去了，但我们知道了我们的教育方向。这个暑假，我将这本书送给读初二的女儿，让她认真地读。我们会共同探讨成长过程中的问题，让她健康、快乐的成才。,发现母亲》（推断）,华为MatePad Pro
书籍,1,当英雄们还未曾出世，甚至远在风炎王朝之前，辰月盛极，天罗首次进入帝都，铁甲的天驱武士默默地坚持着自己的信念。总有那样的一种力量，推动着平凡的人们去演绎不平凡的传奇。他们的故事，不是传说中的英雄事迹，不是神秘的流言，只是对身边亲近或只有一面之缘的人的守护。为此，他们愿意献出一切。这样的人永远都会存在，这样的信仰永远不灭。这是后世英雄们的精神之源。,九州·缥缈录（推断）,华为平板
书籍,1,"当年明月用通俗幽默的语言,为我们还原了那段历史,那段曾经辉煌,最终却归于沉寂和消亡的历史..爹比我认真,五十岁的他没戴老花眼镜,没日没夜的读着..我很惭愧,因为我用很多的时间上网,搞些没用的东东,虽然自己是爱书的人,可如今却很难拿出时间静下心来对待文字..爹说他年轻的时候,用了好多时间来看书,现在都清楚的记得.是他的财富..年轻的我们要多读书,读好书,当年明月,加油哦~!",明朝那些事儿（推断）,华为平板
书籍,1,当读完全书后，感觉到一种面对战争的真实感，感觉到政权是多么残暴，为了巩固自己的权威难道就可以无休止的草菅人命么？迷龙的死完全是典型的中国政权下的牺牲品，死啦死啦的牺牲是那么的无奈与悲凉。,我的团长我的团（推断）,华为平板
书籍,1,当初是在学长和老师的推荐下买的这本书，说是与考研的难度和情景很相似，有利于提高水平，认清自己的英语阅读实力。买回来后按照每天几篇的速度做，分析，理解...觉得快要崩溃了~虽然我英语水平不高，但是看到徘徊在40%左右的正确率，我突然明白的确很像考研的风格，呵呵...虽说很打击信心，但是我觉得题目还是很贴切考试的难度的，对于想寻找自信的同学们还是...算了吧~~~,考研英语阅读（推断）,华为平板
书籍,1,但是，书比网上有删节，例如删掉网络版中轻寒轻轻吻了一下阿离等情节。不知编辑怎么想的，这有必要吗？,轻寒轻轻吻了一下阿离（推断）,华为M3青春版
书籍,1,大卫经历着这样的童年，真的让人不可思议。怎么会有这么残酷的母亲？看完这本书最直接的一个感觉就是大卫的经历虽然激励着不少人，但是却给人懦弱感。我认为不是要傻傻的挣扎着生活，而是要努力去改变不好的情况，改变生活，而大卫一直是报着等待，期待，一旦期待过了限期那个就不是期待，所要做的就是改变！不过这本书真的很好，看完后我哭了，深思了很久，感谢大卫能把自己的经历写给每个人,大卫·科波菲尔（推断）,华为平板
书籍,1,大陆的物业公司与业主以及业主委员会之间势如水火，原因很多，“没有规矩，不成方圆”，即便有了所谓的《物业管理条例》，仍然缺少法律的内在价值评析体系，业主的权利与义务仍然只是一纸具文，不足以让各方在其位、谋其职。台湾的《公寓大厦管理条例》条文不多，然则直指人心，本书解读，人文关怀良多，法律之外，家园情结尤其令人一叹。昔日鸡犬相闻的景致依然远去，但愿公寓楼中犹有天涯比邻。,公寓大厦管理条例解读（推断）,华为平板
书籍,1,打算送给几位朋友看看。即使是已经工作了的，也有些事情没想明白，所以看看会有好处吧。对在职场上还没经历过什么的人，给点准备的心理空间。工作中总会有不顺，每个人都会沮丧、受打击，但是一切都会过去的，关键是走过之后，事情给你留下了什么。之后的你我，会不会比以前成熟……,钝感力（推断）,苹果m2平板
书籍,1,打开包裹看到这本书时，书的外面还包了一个塑料袋，里面的纸张摸上去也很舒服，字的大小适中，最主要是因为很喜欢朱生豪前辈的翻译版本，因为需要看原文，但是对原文很难做到全面理解，所以选择拿来前辈的经典译本对照来看。这本书除了收藏了莎翁的四大悲剧之外，还收藏了我本人很喜欢的一部悲喜剧--Romeo & Juliet，所以这本书在我的眼里就变得十分完美了，呵呵~,莎士比亚悲剧集（推断）,华为平板
书籍,1,"翠花说:就叫我""副处吧""......伍天舒就这样和她成了一样的副处级干部.小说中,类似这样的自我调侃和阿QS式安慰比比介是,也让我们在这种自谑中,体会快感和收获快乐的心情.文字流畅,直白,又有点伪农民似的智慧,让人忍俊不禁,读起来又不用浪费脑细胞,绝对的小沈阳类大片.每个章节里开头部分的伍天舒日记,绝对的神来之笔,好书啊,好书.今天你副处了没,呵呵~~`",副处长（推断）,华为平板
书籍,1,崔雅的感性和生活体验与肯的理性与理论思考完美地结合，给我们展示了一段真实而艰难的病痛生活之外，他们的内心的艰难与美丽。陆陆续续读过这本书不下3遍，在我开始学习内观禅修之前、之后，都不断地找时间来读这一本书，它揭示了这两个人在理性、心理和灵性的不同层面上的非常深刻的体验和发现，以及不断地自我的解脱和成长。我深受启发，深受感动。推荐给所有的朋友。愿我们在生命的磨砺中成长，解脱。,恩宠与勇气（推断）,华为平板
书籍,1,从组织成长角度看，四大名著是有分工的，西游记讲的是草创阶段的组织，如何活下去是最重要的；三国演义是讲国家级大组织的，如何强大、垄断是主要的，重点是如何强大；红楼梦是讲家族型组织的，它最重要的是如何保持、延续问题。比较而言，水浒传讲的是小组织如何变成大组织的难题，山头、门派，都有成长的要求，因此这部书讲的是怎么壮大的问题。它的智慧，都在这里。,四大名著（推断）,华为平板
书籍,1,"从一种比较客观真实的角度,描述了一个活生生的历史人物--李斯以及所处的环境.任何人都摆脱不了他所处的历史背景下.过去了2千多年的人物与我们今天所面对形势有了天壤之别,但其中的人性没有很大改变,为了仕途,血淋淋.也许历史很难还原其真实性,只能接近原来的面貌,就像书中的人物一样,永远都不会了解,他在某个时刻做出了这样一个决定是为什么.读了这本书,你会明白仕途的一种形式,但不是唯一的途径.",流血的仕途：李斯与秦帝国（推断）,华为平板
书籍,1,从天涯一直追到此书出版，虽然花了不少时间等待，都是十分值得的。沧海桑田，我们很多人已经习惯了现代化的医院，习惯了西医的一切学说，却恰恰把老祖宗留给我们的东西渐渐遗忘。很高兴罗大论医生用了一个特别的角度来描绘那些为我们医学事业做出巨大贡献的大医们，让我们不仅了解他们学医德经过，了解一些中医的基本知识，更重要的是什么才是真正的大医！！！绝对好书，值得收藏！！！！,大医之路（推断）,华为平板
书籍,1,从书名到封面都是那么的吸引人ENO 淡淡的水彩和文中淡淡却让人深刻的感情相得益彰也许我们对生活中不可能存在的感情保有更多的期待不论是男女之恋，还是男男之恋所以我们才会爱上这本书爱上书中的主角即使我们身边不会出现但是文字陪伴着我们头脑中总是期待着一直期待着,ENO（推断）,华为平板
书籍,1,从拿到书开始我就已经知道我家的宝贝一定会喜欢的，从文字和图画的色彩上，无一不是孩子们喜欢的。我只看了一本就发现这书里面体现的东西不只是昆虫的知识，其中更为重要的是一种亲情的体现。当砂泥蜂自己要产卵的时候才真正的明白自己的妈妈为什么在自己还是幼虫的时候不在自己的身边，一切都因为爱，为了保护自己的安全。现在的孩子都太自私了，多看看这样的书，家长多讲讲故事里的喻意，给孩子思考一下吧。,昆虫记（推断）,华为平板
书籍,1,从开始读关于家庭教育的书，到现在也不知读了多少本。但至今为止我认为这本是对我感触最深的一本。书中的阅读是学习的魔杖，让我最受感动。女儿今年读一年级，学习很轻松。她在中班时就可以自己单独看小说。曾经很多人问我，你女儿是什么时候认识这么多字呢？一直以来我也感到很奇怪，她是从什么地方认识这么多字？看了这本书后我才明白原来她是在我给读故事中学会的。写这么多就是想说这真的是一本难得的好书！,朗读手册（推断）,华为平板
书籍,1,从第一次阅读这本书的那一刻开始就越来越发现里面的细节竟然跟我和你之间有太多太多的雷同之处，这。。。。。。。。算是巧合吗？所以不管自己将这本书还有这个电影看了千遍依然会泪流不止，一次比一次哭的更加伤心痛心，可是却不知道为什么会哭泣，不是因为里面的情节，并不是！因为电影并不感人，甚至。。。。甚至可以说是有点枯燥。。。。可是自己还是不自觉的流下了眼泪。。。为你，也为自己。。。,挪威的森林（推断）,苹果iPad Pro
书籍,1,从爱生忧患，从爱生怖畏；离爱无忧患，何处有怖畏？是故莫爱着，爱别离为苦。若无爱与憎，彼即无羁缚。,步步生莲（推断）,小米平板
书籍,1,从《潇然梦》到《少年丞相》不能不说小佚的文总能给人带来感动和心灵上的震撼。无论是祈然的专情还是亦寒的执着都让人感叹不已，而女主也并非如其他文中的幸运，作者似乎总是扮演着后妈的角色，为她设下种种磨难使其成长，让人看了欣慰，谁说不是呢，彩虹总在风雨后，人都是在不断的磨练中成长的，唯一不同的是他们的目标不同所以成为了社会中不同的人。看着临宇的成长，痛，并快乐着，于是我也跟着快乐着。,少年丞相（推断）,华为平板
书籍,1,此书最受益是这两条1、心中无冷病，不怕热上身。2、肌肤不喜欢冷若冰霜的美人，美丽的女人一定要让身体暖和起来，其他所有的问题都会迎刃而解。说实话以前太不注意“寒”了，搞得自己现在身体很差，脾胃虚寒到了极点。开始认识到要对自己身体好并努力改善生活方式。现在已经好多了，多靠了这些仁心仁术的医生们的书。非常感谢！,温度决定生老病死（推断）,苹果M3平板
书籍,1,此书算是一本论文合集，对于中国古代甲胄的介绍尤其详细，包括从原始社会到宋朝。里面对各代甲胄的特点、材料、制作工艺介绍得十分具体，并且配有表格及清晰的线描图，令我受益匪浅。对于武库、兰錡和胡床的考古发现我还是第一次看到，觉得很新鲜，总算明白胡床是什么样的了......可惜对于兵刃的介绍还不够多，但还是不失为一本内容丰富而的好书。,中国古代甲胄（推断）,华为平板
书籍,1,此书是从基因科学的角度阐述人类的起源，和我们传统的民族观，历史观大相径庭。根据基因科学家的研究，现在地球上可以找到的所有人类的祖宗是共同的，都是那对非洲亚当夏娃。作为中国人，一开始很难接受，其实外国人开始也不接受。不过，相信的学者，包括百姓越来越多，坊间越来越多听见关于黑亚当夏娃的议论了。耐着性子读完它吧，挺有意思的呢。,人类基因的历史地图（推断）,华为X2
书籍,1,此书堪称经典。无论是否研究历史，无论是否爱好历史，甚至无论是否了解哪怕一丁点历史，都应该看看这本书。通篇虽然讲的是历史研究法，并且是高屋建瓴、独具慧心地讲解了历史研究法，但更重要、更可宝贵的，是一代宗师的处事、做人之哲学，是一代大儒对于国学、史学乃至中华文化的深沉感悟。治学之道，首要治心，在此体现的淋漓尽致。以一种什么样的人生态度去生活，看看钱穆，很有启发。,国史大纲（推断）,华为平板
书籍,1,词学概况深入、全面，对了解词与词学的基本知识大有帮助。但作者的及格观点值得商榷：1.作者称词有严格的要求和填词的文学功底，这点事肯定的，但说不要轻易填词，否则是无谓消耗精力，却不敢苟同。因为，现在的很多年轻人中都风行填词，表达自己的思想、情感，又况，词的格律在苏轼时已被打破，在南宋时又与音乐脱离二层为一种独有的文学体裁。因此，作为继承祖国优秀文化的考虑，保留、传承、推广和广大这种文化，应多鼓励今人在具备文学修养、素质的条件下，多尝试填词。2.有种观很政治化，要求词要具有社会意义，否则流失风花雪月、不痛不痒，没有显示意义。其实，古往今来人于时代、社会相比都是渺小而软弱的，也许今天的一首词只想书法一下烦恼的心情，借景、物以抒怀，心理上达到“移情”的作用，有益于人的生存、发展。再说，社会的暗点，不敢说、不能说，也不可深说，这是有局限性的，即所谓的社会性就显得很单薄，反而以为的气球就只会走入歧途，或者相反面，比如歌功颂德，侮辱了词本身的优美。此书甚好。五星。,词学概况（推断）,华为平板
