cat,label,review,predict_before,predict_after
书籍,1,一个发达国家热爱攀登高峰的男人，一些最贫困地区的孩子，根本不会有交集的他们，因为一次意外而联系了起来。在喝过三杯茶之后，他们成为朋友，为了一所学校，这个男人过着苦行僧的生活，而当地的村民宁可牺牲他们的牲口也要捍卫他们正在搭建的学校、、、我们过家也有那么多的贫困地区，同样也有渴望读书的孩子，希望也有更多的人去帮助他们，让他们有更广阔的天地。,三杯茶（推断）,张爱玲作品
书籍,1,一到四部我全买了，虽然四本书中有很多重复的地方，但对我了解以及能够去看懂红楼梦的帮助实在是太大了，呵呵！此书上部分讲薛宝钗的情爱问题其实很多第三部都说了，这里只是再增加了一些信息，比如宫廷如何选秀的，还有古代皇帝妻妾的排位等等，也算是增长见识吧！至于下篇都是新内容，所以我觉得刘心武先生的这四部书都值得买！,刘心武揭秘红楼梦（推断）,中国为什么不高兴
书籍,1,一本最近几年来少有能让我拿到手就一口气读完的好书。赵老师一生的思想历程，读之惊心动魄。很喜欢赵老师提出的“天文地文人文神文”的大尺度框架，拥有这样开阔的认知领域，拥有属于自己的科学，艺术和哲学的宗教，的确能让人生充实而幸福。天地者，万物之逆旅，光阴者，百代之过客，浮生若梦，为欢几何，相信这本书值得每一位追求丰富内心世界的读者阅读。,赵老师一生的思想历程（推断）,原生家庭
书籍,1,一本提高高个人修养和能力的书，无论我们从用角度去看玫琳凯化妆品公司、玫琳凯.艾施其人，但这本说能给我们的智慧确实不言而喻的,玫琳凯·艾施（推断）,梅瑟·迈尔的作品
书籍,1,一、教育问题首先是观念问题，老人当然普遍存在观念落后的问题，而相当多的年轻父母也因旧式教育方式的薰染，观念仍旧不够先进。二、在掌握比较先进的观念后，重要的是看父母怎样掌握尺度，这是因人而异的，因孩子而异，因大人而异，强求不来的。三、最后，也是最重要的一点，那就是坚持把先进的观念始终运用在教育过程中，这是具有共性的。,好妈妈胜过好老师（推断）,咕噜咕噜转
书籍,1,也许人性中有那么点善良，祈祷着他人或得和平跟幸福战争离我们貌似很远，其实却非常的近，只是几个纬度或是几年，想一下其实真的非常近。故事中的莱拉，真的很欣赏也非常敬佩，她如果是阿富汗新一代女性的象征，那么怎能会不让人起敬。看着别人的悲惨想到的却是自己的幸福，这样真的残忍，可是我是一个懦弱的人我能做到的或许只有不停地感恩，感激所有的一切。感激平凡的一切感激和平！,灿烂千阳（推断）,窗边的小豆豆
书籍,1,也许，有一天，这本书会给我们一种力量，让我们回头，看看我们年迈的父亲，是否也在回忆多年以前的温馨。,父亲（推断）,袁先生的作品
书籍,1,也或许，你看完A型、B型、 O 型、AB型这所有的四本说明书后，觉得书里所言都不怎么确切，那么恭喜你。在你身上，一种新型的血液很可能已经诞生了。你不妨为自己的血型起一个独特的名字，比如说，X型，然后，你就动手为自己也写一个《X型人说明书》吧。说不定，很多的X型会因此找到共鸣，觉得自己在这世界上，再也不孤单了呢。,X型人说明书（推断）,池莉的作品
书籍,1,要是这个世界上的人们都能相互理解的话，这个世界上就不存在歧视这样的事了吧。每一种人都并不可怕。B型人只不过是心智更为敏捷，能够不被外物束缚，远远走在前面罢了。当然他们也不愿自己被过多地累赘拖累住，愿意独自走在前面。但本质上他们无害于这个世界上的其他人类。因为大家根本的着眼点就不同，不存在什么“资源被抢占”的问题。因此大可不必像纳粹对待犹太人那样把这个血型的人赶尽杀绝。,B型人自己的说明书（推断）,蔡先生的作品
书籍,1,要灵活运用，不能太死板了！记单词还是要开动脑筋，不同的单词用不同的方法，如词根词缀法、联想法、谐音法、逆向法等。,17天搞定GRE单词（推断）,饮食定生死
书籍,1,杨怀定先生祝福你健康长寿！祝福你们全家，祝福你们的小孙子（涨停板）健康快乐！一个被你深深感动与敬仰的普通上海投资者2009年5月7日,杨百万（推断）,好妈妈胜过好老师
书籍,1,学习是必要的，也是痛苦的。 让学习变成一件快乐的事情，其价值是意义非凡的！这本书给你一个通信的全景知识，大量的幽默的类比说明，让你快速明白一个原理的真正内涵是什么，而你在获得这个知识的同时，也体验到了轻松愉快的幽默。中国人一向喜欢把知识搞得严肃而庄重，让热爱学习的我等凡夫俗子望而却步，感谢此书的作者，让我可以把学习当作一件有趣的消遣。期望作者出版更多的关于通信方面的专著！,通信原理（推断）,青铜葵花
书籍,1,学习了很多外企的规则和生存之道，有不少东西让我开阔了眼界，就像被培训了一次似的。蛮喜欢拉拉的性格的，幽默，善良，聪明。她的思路清晰是我很佩服的一点，值得学习。一直在寻找自己的方向，而通过这本书，开启了我的一些思路，比如要获得财务自由，比如早日实现退休……还在奋斗着的我们，需要继续加油！把这本书推荐给了我的朋友，相信他们也会喜欢。相信对于初入职场的学子们同样受用！,杜拉拉升职记（推断）,桐华的作品
书籍,1,学了十多年英语，但一直一瓶不满半瓶摇的，工作几年后，深感英语的重要，就跟一个朋友学。她有多年的英语教学经验（主要是教像我这种学过但没学好的已工作的人），在挑选教材时把市面上的都看遍了，最后选中这个。她的理由就是：这个教材从人物名字的选择，到情景会话和俗语的选择，都和现实贴得很近。比如现在很多美国女孩叫EMILY，书中也有conversion里的主人翁叫这名。现在我学完了1，正在学2。,走遍美国（推断）,季羡林的作品
书籍,1,许多下围棋的人都会有一个困惑，那就是害怕对手的力量强，趴在战斗中吃亏，以及如何增强自己的战斗力。我也是，一直希望自己的力量增大，希望战斗中下出手筋获得优势，乃至胜利。还是看看战斗至尊坂田先生的棋吧！从他鹰隼般的捕捉战机的嗅觉和快如剃刀般的手法中一定能找到你想要的。我很喜欢这套书，她也是坂田先生毕生著作的精华，值得你拥有！,坂田荣男全集（推断）,活着
书籍,1,许多关于生命、生活的真谛，对我们这些平凡人来说，只有在不断的经历洗礼后，才能真切地感受到它。通过对前世、今生、来世之间关联的探索学会了学习，改变，感恩，在一次次经历中使自己向更圆满的方向前进。,前世今生（推断）,好妈妈胜过好老师
书籍,1,性教育一直是想与女儿说却又不知该如何开口的内容。在当当网上看到这套书时很高兴，当即就决定买下来。刚开始想定上下两册，但上册缺货，先买的下册，女儿七岁，很感兴趣，连看了好几遍。等买了上册后，女儿又把下册找了出来，上下两册又看了好几遍。以后的一段时间里，女儿还经常找出这两册书翻看，和妈妈讨论一些相关问题。很不错的书。,成长与性（推断）,灰袍奶奶和草莓盗贼
书籍,1,"幸亏当时打了五颗星,这套书现在已经是一岁十个月儿子的最爱了,每天一说到讲故事,就开始要我讲车来了,你好,我要拉巴巴......,不愧是2005-2008全国优秀儿童读物。",车来了（推断）,太医医学
书籍,1,兴许是本身对阴阳师的书籍资料看的已经很多了，很喜欢那个淡然的男子，那么了然看世俗的眼神。所以看到有关于他的小说还是很感兴趣的。看到很多人看完的评价觉得应该是不错的。冲冲拿到后就一口气看完了，很白目的小故事~算是生活小品，的确不错。蜜蝶迷迷糊糊又不矫情的个性也是我所喜欢的~但是终归有点小小遗憾，还是冲着料想到的结局发展下去了.......小小憾事~罢了罢了~小说终将是带给人欢乐很温暖的~,阴阳师（推断）,中国不高兴
书籍,1,心若自由，身沐长风，无游天下，不离不弃凭这这样的信念，冰依，祈然，步杀，踏上了航海的旅程小佚用奇妙的文字体现了一段惊险的旅程，一种不离不弃的情义。真的想说很好看，看了开头，就会被吸引，那种从字里行间体现出的刺激的感觉，幽默的气氛，感人的情义，都让我的心情随着它一起兴奋，一起大笑，一起感伤。冰依是我所喜欢的穿越文中为数不多的女主角之一，看一本小说，我对人物的性格特点是很看中的，喜欢冰依在顽皮中带点沉稳，迷糊中带点精明，脆弱中带点坚强的性格，她不是温室里的花朵，即使在祈然的保护下，却依然不会失去生存的能力。祈然无疑是一个怪物，貌美绝伦，智谋绝顶，有操控一切独立天下的气势和手段却可以为冰依抛下一切，总觉得他的一切得来的都太容易，做什么都太简单，所以才会让他一直没有安全感，对冰依总是患得患失。然而他也不是最完美的，我觉得这点小佚描写的非常好，因为没有一个人是十全十美的，祈然其实是一个比较自私的人，只在乎自己在乎的人，其余的一切都不在乎。从这点上来说我喜欢冰朔更胜于祈然冰朔继承了祈然的美貌和智慧，继承了冰依的坚强和顽皮。喜欢他的温柔，喜欢他的善良喜欢他和冰依一样捉弄步杀时语气，总是让我看的哈哈大笑步杀是一个很好的男配角，他是沉默的，可是却无法让人忽视他的存在，有时我真的很想知道，对于冰依和祈然，他会更在乎哪一个？我想会是祈染吧，只有他可以叫他步小佚是很善于抓住人物的性格特点来写的，她取的人物的名字我都好喜欢啊，冰依，祈然，冰朔都好好听。文章的情节，无疑是精彩的，里面的每一个地方都透着一股神秘感，刺激着我读下去，看了第一本后，看第二本开头，我偷偷去翻后面的结局，一看吓一跳，怎么和卫聆风在一起了？？？后来带着疑惑乖乖的从头在看，才知道，那只是为卫迷写的，呼出一口气。对于冰朔的离开我分外的难过和失望，总想问问小佚，为什么冰依可以留下，他就不行，可是世上的事真的没有十全十美的吧。,潇然梦（推断）,金老师的作品
书籍,1,写意曾经的恨，那样的揣测让他不安，也许相对于写意的报复，这样的不安更加折磨，所以我相信对于写意的报复，他虽然难过伤心，却也应该感到释然，他终于可以清清楚楚感觉到写意对他的恨，感觉到写意曾经的痛苦，伤口揭开了，那么痊愈的日子还会远吗？我想对于写意来说也是如此吧，所有的恨都掏空了，剩下的应该就是爱了吧，对过去曾经追逐过的阿衍的爱，对如今眷念上的厉择良的爱……,良言写意（推断）,金老的作品
书籍,1,写了两本评论，到这本有点不知道说些什么了，呵呵……但是刚才看到有人说一般，觉得还有点神奇，可能自己心里对这一套书的评价真的太高了吧～～和《爱与人生》一样，这本虽然名之为“情满人间”，但并不止于男女之情，而有着社会大情或者家庭小情，看完后还是会有很多感触的吧；如果只想看情爱的可以买《无尽的爱》那本。最后，照我同学的说法，这个蓝色蓝得有点寒碜，呵呵，不过我个人是觉得还不错啦^^,情满人间（推断）,A型人说明书
书籍,1,写的很有趣，语言很生动，现在沉浸在洋流的故事中（书里虽然只有一个洋流的故事，但是会让你开始对洋流产生浓厚的兴趣~~）。如果没有地图册的话（地图也不太管用，地图册，有详细内容的那种）最好停止阅读，否则就跟看天书似的。（当然我说的是一般人）另外不好的一点就是书的内容可能比较旧，好在有的过时的内容已经被标注出来了，不爽的是作者不知道指南针是中国造的……当然，每个时代都有局限性，平静……,海洋与文明（推断）,输赢
书籍,1,小侄女8岁了，很喜欢看书，就像我小时候一样，所以我怎么可能不满足她的这个小小的又是这么美好的愿望呢！她看过杨红樱笑猫系列的一本，好像与什么猫耳朵有关的故事吧，就开始天天幻想着能拥有全套了，看来笑猫还真有吸引力呢!不过我儿子不怎么有兴趣，可能杨红樱的书更适合女孩子吧。我已经能想象到小侄女拿到书的享受样子了，呵呵，赠人好书，手有余香啊，我也开心呢~~,杨红樱笑猫系列（推断）,曾子航的作品
书籍,1,小学的时候同学借给我看了很多本，暑假的时候就彻夜迷在机器猫和大雄他们的冒险故事上了，里面有很多稀奇古怪的道具，还有很多光怪陆离的故事，真的相当有趣，很轻松的读本，有时候有会有伤感悲哀，有很多地方都多少提到了一些保护文物保护灭绝动物的忠告，有时看了静静地想想，很引人深思。总之，这是我最喜欢的一部漫画，给我留下了很珍贵纯洁的回忆。,哆啦A梦（推断）,美学十五讲
书籍,1,小汤的书很多，同一版本的名称就有很多样儿，购买起来，一度很迷茫。所以，请当当的工作人员校对，同意口径，让消费者购买起来，不至于云里雾里的。辛苦了。这本书，印刷质量很好。因为是儿子的钢琴老师指定的，所以才到当当网上寻找，拿到书以后觉得不错。唯一遗憾的是，附赠的vcd质量欠佳，孔祥东的讲解总是卡壳。其实也无所谓了，毕竟书才是教材嘛,小汤（推断）,给孩子自由
书籍,1,小说一开始就写了一个很血腥的场面，拉到现实又是一样的血淋淋的画面，好象这个梵天之眼只能给人带来灾难，整篇小说读起来让我觉得很压抑，说不出来的感觉，作者写作有点过于神秘，有点夸张和造作之嫌，我感觉一般而已，特别是结尾，如果男主人公一直在医院，那些发生的故事，死去的人是真的吗，无法得知这个秘密是否真实存在。反正这样的结果我不能想象，好了就写这么多吧，愿意看的人可以买一本看看，感觉是不是和我一样呢,梵天之眼（推断）,初等数学复习及研究(平面几何)
书籍,1,小说通过汉娜和米夏关系及命运的描写，来影射经历过战争的德国人和在战争后出生德国人的生活经历。书中的一句话“我爱汉娜的痛苦在一定程度上是我们这代人的命运，是德国人的命运”。更好的诠释了战后德国社会的矛盾心态、爱恨纠葛、人性道德与正义的缺失与回归及其中的无奈。,朗读者（推断）,好妈妈胜过好老师
书籍,1,小说很早就看过，一直在纠结要不要买来收藏。买，肯定有人说不就是一本青春小说，还是半个同人形式的 意义不大；不买 可是书里那些往事曾经是触动我的，真实的，让我不由自主地有共鸣的；结果还是情感战胜理智~ 哇咔咔到货的时候专门看了看 嗯 有盘~（虽然我私底下更加喜欢另外一版《此间》的广播剧）~书的封面有点压痕 不过都还好~最后让我照搬一句不知道哪里来的签名，经不住似水流年，逃不过此间少年。~,此间少年（推断）,三救姻缘
书籍,1,小木头很喜欢这套书，就象喜欢卡梅拉那套一样。不管是讲里面的内容，还是把书按套叠起来，都能带给他很大的快乐。而且小木头上托儿所之前，我和他反复地看着关于讲幼儿园的那两本书，让他明白了托儿所里只有老师和小朋友和玩具们，没有爸爸妈妈，但老师会象妈妈一样爱他照顾他，而且还有很多小朋友和他一起玩，会很快乐。后来小木头上托儿所适应很快，一周就适应好了。,卡梅拉（推断）,血玲珑
书籍,1,小海狸的书儿子看到后就很喜欢。那天中午我放在沙发边的桌上，想着儿子放学时就会发现“礼物”。果然，他看到了，而且一口气就看了好几本（他在电话里兴奋的告诉我，而且对我说谢谢）。在接下去的几天里，他自己看，有时也要求爸爸或我给他讲。我们有时也请他讲给我们听。很快乐的时光。甚至于周末去小哥哥家玩，他也要求带这套书去。。。。。,小海狸（推断）,十年的你
书籍,1,小孩马上上小学了，想买一本适合他阅读的书，要求是：字简单、故事能吸引人、最好让小孩在阅读时有一些启发，或者说是收获。网上评论不错，看看目录上有几个故事以前看过，挺好。抱着试试看的心情买了一套。回到家和小孩一起朗读，我们很喜欢。看得出来所有的文章都是编辑精心选择的。除了对小孩来讲生字有点多外（生字多一点也没关系，再大点就可以自己读了），各项指标均达到了要求。,没头脑和不高兴（推断）,我妈妈
书籍,1,想买此书的时候却赶上没货，等了好久终于到货，速买来读之，虽然读之前看了大家的评论，觉得我可能也会被感动的稀里哗啦，一路读下来虽然最后结果是我没流泪，但是却是伤感的几乎一夜未眠，那是一种什么样的爱情！让人肝肠寸断啊！据说此故事发生在我的家乡，细细读来发现真得很像呢，听说好像剧组已经在家乡选址准备拍摄电视剧了，期待ing !,山楂树之恋（推断）,LULU的减肥宝典
书籍,1,相当好的一本书，系统的解释了数独的解法，并简单说明了其发展的历史，可以看出作者强悍的理科背景。但显然作者对商业规则一窍不通。在互联网这么发达的时代，竟然不跟进对附带光盘程序的及时更新，而且拙人我至今未能在任何电脑上成功运行。可见作者在此事上粗糙的态度。总体而言，是一本数独方面的中文杰作，所以强烈推荐！,数独（推断）,别笑！我是英文单词书
书籍,1,相当不错的一本书！！不同于那些食谱，这本书是很系统地讲解川菜，一个类别一个类别地讲，从佐料开始讲，很详细而实用，而且一点也不枯燥，感觉就像和一个大厨对话一样，生动而且受益匪浅。全书没有一幅图片，却照样看得来口水直流。我妈照着上面所说做了一次瓦块鱼给我吃，手艺和以前比较就像两个人做出来的，味道不摆了～～～强烈推荐！！非常值得收藏。,川菜烹饪技术（推断）,迷藏 血色面具
书籍,1,现在人们的生活压力很大，在很多时候自身的健康问题往往都被忽视了，特别是男性朋友，所以日常生活中多了解一些与健康和保健相关的知识还是必要的。这本书中介绍的掌纹知识及正确判断掌纹对普通百姓来讲还是有些难度的，如果只是作为对自身健康的大概了解还是不错的，总之，身体的健康还是要靠自己日常的保养保护，另外乐观向上，保持健康的心态也是对身体健康最重要的。,从掌纹看健康（推断）,沈从文作品
书籍,1,"现在觉得还是值得购买的.我们现在听了近一个月,基本上能背出第一本来,第二本已经在听了.字还没认.每天在家就听,想想反正还小,上小学前三年功夫,相信不管怎么样,总是能全部弄熟了吧.一千多个词汇量,最主要还有语感,还有自然科学知识.至少家里总是有了英语环境.",清华幼儿英语（推断）,痴相公
书籍,1,现代许多年轻人喜欢读那些女人气的散文，对民俗作品不屑一顾，其实，民俗民情才是我们中国文化的根。花再娇艳也要有根的支撑啊。太湖实在是茶文化的故乡，就算日本的茶道也起源于中国。更何况茶圣陆羽的茶经也在太湖写成。太湖畔的惠泉山水，曾经让唐朝宰相李德裕，像杨贵妃千里传荔枝一样的让快马从无锡送去惠泉山水到长安，只为煮茶品茗。太湖茶俗，实在影响了中国数千年啊。这本书，你值得拥有。,茶经（推断）,撒哈拉的故事
书籍,1,先看过电影，当时不知道是打榜热门，就觉得拍的还挺美的，一般的吸血鬼电影都是画面阴暗，神秘，血腥，但是这部多了很多温情，更象是人类普通而且真挚的情感。于是买了书，老实说先入为主，看书的时候很自然浮现的都是电影中扮演者的脸。很有画面感，但是总体讲，翻译的不好，囫囵吞枣，前后思绪不连贯，好像是那种很不耐烦的直译出来的中式英语，而非中文的叙事习惯，太混稿费了。好在故事情节还比较引人入胜。,暮光之城（推断）,阿郎的作品
书籍,1,先看的电影后买的书。说实话看电影时我很讨厌男主人公，后来通过看书才对其复杂的心理过程有了更深刻的认识，也更能够理解他和汉娜在战争和纳粹时代背景下扭曲的情感经历。可我还是认为他并不是真的爱上了汉娜，他只是爱上了他的爱，这个爱的载体是一个比他年长许多，性格与其一样执着顽固而且还目不识丁的纳粹看守，这个爱还无法经历时代变迁和人云亦云的世俗考验。真正可悲的是汉娜，她的极端自尊和羞耻心大大地超越了生命的力量，使她最终选择了死亡。,朗读者（推断）,黑背的作品
书籍,1,"先借用老徐在这本书封面上的话说:?读聪明女人的书是种享受,会心,不累...?看过第一部后,才想买的第二本,虽然是本小说,却凝聚了职场的风云冷暖,看过的关于职场的书很多,但却只有这两本印象深刻.感觉读过之后很过瘾,从人际关系到专业知识,统统恶补了一遍,最关键的是,它可以给城外的人窥探高墙里面的故事,并时刻准备跻身其中...",杜拉拉升职记（推断）,孩子慢慢来
书籍,1,细读此书，心情沉重得无以复加，又去找电影《蓝风筝》来看，一样是写右派，但电影对那场灭绝人性的迫害的描写明显不及此书来得细致、深刻、生动，有力度。当然了，给予我的感受也就不是那么刻骨铭心了。这是一本不可多得的好书，每一位中国人都应该去读一读，了解一下那段历史，这样，在下一次“革命”前，才能保持清醒和理智。,蓝风筝（推断）,正面管教
书籍,1,喜欢这本书的封面，简洁明了。刚看完这本书的时候，一头雾水。合上书本，好好想想，这个故事是说牧羊人追寻梦想，经过种种磨难，长途跋涉，终于到达目的地，找到宝藏。每个人心中都有自己的声音，很多时候都没有勇气去相信，接受它。牧羊人在王的指引下，努力朝着宝藏前进。放弃羊群，外出游荡，放弃工作和安逸的生活，接受考验，坚持梦想，有舍才有得。最终找到属于自己的宝藏。,牧羊少年奇幻之旅（推断）,我和狗狗的十个约定
书籍,1,喜欢小动物尤其是猫咪的XDJM都要看一下，非常有意思！不喜欢小动物的人就更应该读一下，猫咪或者动物的世界与你没有什么不同！,猫（推断）,门第
书籍,1,"喜欢吴小波的文字,带着新闻人特有的冷静,如针线般密密地将这些历史织补到一起。看着这本书，我的脑海里却全是激荡三十年，成也英雄，败亦人杰。10个案例里，无一例外地充满了冒险家的气息和敢为人先的豪迈，正是为他人所不敢为，他们成功了，却又因为各种原因（企业扩张的原始冲动占多）迅速陨落，怎不让人叹息。这是个传奇的年代，无法评说它的颜色，只知道色彩绚烂之极，原来竟在消逝前那一刻。",大败局（推断）,非诚勿扰
书籍,1,喜欢微微的勇敢和敢爱敢恨，那是怎样的勇气让她那样的义无返顾？陈孝正总是以为，无论他什么时候到，微微总是在原地等他，但是他怎么可能理解微微在等待的过程中需要多少次的自我安慰和期待？他给她的，我倒感觉像是依赖，因为习惯，所以有了依赖，就算等若干年之后他愿意为了微微放弃一切的时候，也很那分辨那到底是爱还是男人征服欲望的驱使？微微执着的让人心疼！,致我们终将逝去的青春（推断）,我为什么讨厌那个女孩
