sku_id,item_name,content,score,clean_content,is_spam,spam_reason,topic_id
7081550,comment,在惊喜和焦虑中等待京东的快递小哥，盼望着，盼望着，终于今日收到京东小哥的件，急忙打开点亮屏幕，honr熟悉的映入眼帘，惊艳，窃喜，犹如美玉一般捧在手心，每每手指滑过，犹如触摸到婴儿的肌肤一般润滑，每一个应用哪么的熟悉，速度飞快的上网体验，没有丝毫卡顿，行云流水，犹如人在云端，飘飘欲仙，欲罢不能，没错，购物上京东，手机选荣耀10！,5,在惊喜和焦虑中等待京东的快递小哥，盼望着，盼望着，终于今日收到京东小哥的件，急忙打开点亮屏幕，honr熟悉的映入眼帘，惊艳，窃喜，犹如美玉一般捧在手心，每每手指滑过，犹如触摸到婴儿的肌肤一般润滑，每一个应用哪么的熟悉，速度飞快的上网体验，没有丝毫卡顿，行云流水，犹如人在云端，飘飘欲仙，欲罢不能，没错，购物上京东，手机选荣耀10！,0,,9
13521715420,comment,手机用着不错物有所值,5,手机用着不错物有所值,0,,2
6176077,comment,性价比很高的一款手机，拍照效果不错，电池也很耐用，一口气买了6个送给亲朋好友，超划算！,5,性价比很高的一款手机，拍照效果不错，电池也很耐用，一口气买了6个送给亲朋好友，超划算！,0,,42
3901175,comment,运行速度好卡，机盖好塑料的感觉，上手好像玩具。,3,运行速度好卡，机盖好塑料的感觉，上手好像玩具。,0,,-1
26128018111,comment,昨晚付款今天上午收到、外观设计漂亮。快递给力相信京东品质保证。,5,昨晚付款今天上午收到、外观设计漂亮。快递给力相信京东品质保证。,0,,8
6610412,comment,手机各种性能都不错，很顺畅好用，京东物流特快。,5,手机各种性能都不错，很顺畅好用，京东物流特快。,0,,8
21845662740,comment,物流挺快，手机用着合适，给店家点个赞?,5,物流挺快，手机用着合适，给店家点个赞?,0,,7
25531193076,comment,东西收到了，还不错?。,5,东西收到了，还不错?。,0,,35
12764636413,comment,屏幕显示还是很不错的，基本达到我的预期，谢谢小米科技！,5,屏幕显示还是很不错的，基本达到我的预期，谢谢小米科技！,0,,0
22863264117,comment,机子原装未开封，很好，信赖京东,5,机子原装未开封，很好，信赖京东,0,,8
29638202857,comment,刚到手，还可以，买错款了，不过一分钱一分货。,5,刚到手，还可以，买错款了，不过一分钱一分货。,0,,35
30153140071,comment,很轻薄，美观，好用,5,很轻薄，美观，好用,0,,27
30323689521,comment,手机好看又好用，物有所值，是正品，值得购买,5,手机好看又好用，物有所值，是正品，值得购买,0,,2
7437788,comment,这里对比一下小米8跟一加6。外观不用说了，小米浓浓山寨风，质感也不行，一加的方形还是比较有好感。主要说下屏幕，同样都是A屏，观感上来说，小米发灰，不够一加鲜艳，亮度也差一点。但是听说一加不是顶级三星屏，所以不支持息屏常亮，有待考证。小米好在屏幕形状跟边框一样，而一加因为机身有弧度，所以跟屏幕的边不一致，美观度下降。小米的红外识别可以忽略，非常差。原来觉得iPhone X的识别不准，用了小米，简直天上地下，现在等于还是用后背指纹。拍照不用说了，小米很差，一加很清晰，解析度高。最后说下小米好的地方，小爱太方便，NFC也必备，一加的NFC就是装饰，上海地铁等了两年了，还是我自己破解NFC-Sim卡才能刷。miui十问题还很多，比如息屏常亮竟然没有消息提醒，只有时间。一加就很多种样式并且有提醒图标。闹钟有进步，有女生声音轻轻提醒你起床，并且报时说天气什么的。等探索版上来应该会抢，现在还是用回一加就好。对了，还有个问题，miui10连接蓝牙耳机时，耳机调音量和手机调音量是分开的，很麻烦。,5,这里对比一下小米8跟一加6。外观不用说了，小米浓浓山寨风，质感也不行，一加的方形还是比较有好感。主要说下屏幕，同样都是A屏，观感上来说，小米发灰，不够一加鲜艳，亮度也差一点。但是听说一加不是顶级三星屏，所以不支持息屏常亮，有待考证。小米好在屏幕形状跟边框一样，而一加因为机身有弧度，所以跟屏幕的边不一致，美观度下降。小米的红外识别可以忽略，非常差。原来觉得iPhone X的识别不准，用了小米，简直天上地下，现在等于还是用后背指纹。拍照不用说了，小米很差，一加很清晰，解析度高。最后说下小米好的地方，小爱太方便，NFC也必备，一加的NFC就是装饰，上海地铁等了两年了，还是我自己破解NFC-Sim卡才能刷。miui十问题还很多，比如息屏常亮竟然没有消息提醒，只有时间。一加就很多种样式并且有提醒图标。闹钟有进步，有女生声音轻轻提醒你起床，并且报时说天气什么的。等探索版上来应该会抢，现在还是用回一加就好。对了，还有个问题，miui10连接蓝牙耳机时，耳机调音量和手机调音量是分开的，很麻烦。,0,,0
28672267256,comment,手机很好，麒麟970，说实在性价比很高，玩起来很流畅没有卡顿现象，个人觉得华为还是挺好用的。,5,手机很好，麒麟970，说实在性价比很高，玩起来很流畅没有卡顿现象，个人觉得华为还是挺好用的。,0,,3
5920651,comment,不错，360手机很靠谱,5,不错，360手机很靠谱,0,,-1
25774787882,comment,还可以还可以还可以  反正送人用 看起来不错  就评价这么多吧   不知道说啥了,5,还可以还可以还可以 反正送人用 看起来不错 就评价这么多吧 不知道说啥了,0,,1
8484451,comment,加音量键盘有严重异响，迫不及待收到货，太让我失望了！,1,加音量键盘有严重异响，迫不及待收到货，太让我失望了！,0,,29
7534113,comment,看着挺漂亮，京东快递很快，给妈妈买的，希望妈妈喜欢,5,看着挺漂亮，京东快递很快，给妈妈买的，希望妈妈喜欢,0,,-1
8239683,comment,千万别买，谁买谁后悔，手机还是要选择大牌的，重要的事情说三遍！三遍，，，，，，，然后我们再看看,5,千万别买，谁买谁后悔，手机还是要选择大牌的，重要的事情说三遍！三遍，，，，，，，然后我们再看看,0,,-1
5853593,comment,挺好的，大方又实惠是我喜欢的类型，一直相信京东,5,挺好的，大方又实惠是我喜欢的类型，一直相信京东,0,,8
26266694915,comment,哇，当时看的时候真的感觉粉色不太好看，但是到手后真的炒鸡惊艳，真心话，实物粉绝对不会让你失望，在阳光下面真的好看，还有这个手机拿着真的超舒服，哈哈，客服小姐姐也送了很多东西，用了几个月了过来评价下，这个电池充电和续航真的没得说，这个闪充真的是充电飞速啊！！！一度认为虚电，但是不是，真的很耐用啊，另加一句，这个价钱买的真的很值！！也去验证了，正品哟！,5,哇，当时看的时候真的感觉粉色不太好看，但是到手后真的炒鸡惊艳，真心话，实物粉绝对不会让你失望，在阳光下面真的好看，还有这个手机拿着真的超舒服，哈哈，客服小姐姐也送了很多东西，用了几个月了过来评价下，这个电池充电和续航真的没得说，这个闪充真的是充电飞速啊！！！一度认为虚电，但是不是，真的很耐用啊，另加一句，这个价钱买的真的很值！！也去验证了，正品哟！,0,,-1
5402840,comment,老人用，挺好的，便捷。,5,老人用，挺好的，便捷。,0,,14
7651903,comment,还可以，小朋友玩游戏用的,5,还可以，小朋友玩游戏用的,0,,-1
15612619462,comment,总体还不错啊，储存空间很大，够用，运行流畅，不过赠送的防爆膜太坑了,5,总体还不错啊，储存空间很大，够用，运行流畅，不过赠送的防爆膜太坑了,0,,-1
29619588672,comment,系统流畅是小米最吸引的地方，电池耐用一天刷朋友圈都足够有余,5,系统流畅是小米最吸引的地方，电池耐用一天刷朋友圈都足够有余,0,,-1
21135280362,comment,非常不错，物流也很快，还送了很多东西，送给妈妈的礼物，妈妈很喜欢。,5,非常不错，物流也很快，还送了很多东西，送给妈妈的礼物，妈妈很喜欢。,0,,33
7694047,comment,性价比比较高的手机，买的第二个了，京东价格比店里实惠，送货还很快不耽误事，待电时间挺长的，用了好几天才来评价，一千多的手机里很不错，推荐购买～～～～,5,性价比比较高的手机，买的第二个了，京东价格比店里实惠，送货还很快不耽误事，待电时间挺长的，用了好几天才来评价，一千多的手机里很不错，推荐购买～～～～,0,,-1
7846413,comment,手机外形精致漂亮，颜色深邃，运行速度非常非常快，比之前用的手机好太多了,5,手机外形精致漂亮，颜色深邃，运行速度非常非常快，比之前用的手机好太多了,0,,2
11107032701,comment,手机是正品，用起来很好用,5,手机是正品，用起来很好用,0,,2
26263258528,comment,商品值得购买。电池耐用。价格实惠。,5,商品值得购买。电池耐用。价格实惠。,0,,4
5019352,comment,给老爸买的，还没怎么用，总体不错吧！,5,给老爸买的，还没怎么用，总体不错吧！,0,,18
7651927,comment,手机不错很满意值得推荐非常给力值得入手京东送货快服务好,5,手机不错很满意值得推荐非常给力值得入手京东送货快服务好,0,,8
29196113704,comment,商品与包装都非常满意，发货与送货速度很快，值得一赞的产品。,5,商品与包装都非常满意，发货与送货速度很快，值得一赞的产品。,0,,5
19078286246,comment,手机有卡顿，很慢，有时候会死机，送的礼品比较差，没用就坏了，钢化膜的话割手而且小很多，,2,手机有卡顿，很慢，有时候会死机，送的礼品比较差，没用就坏了，钢化膜的话割手而且小很多，,0,,-1
5375693,comment,质量很好，声音大，适合老年人用，很好。,5,质量很好，声音大，适合老年人用，很好。,0,,12
7081550,comment,"首先给物流点一个赞，真的非常的快(//&nabla;//)我昨天晚上下的单，今天下午就到了
手机在外观方面特别好看，后盖的极光渐变色（好像是这么叫的吧）完全俘获了我这颗少男心(?&gt;?&lt;?）
手机运行方面非常流畅，日常运行方面970处理器完全够用。
 还有散热方面，几局王者荣耀跟吃鸡下来，也并没有跟网上喷子说的那样烫手！！
电量的话3400毫安电池，平时不怎么玩游戏的话，一天一充还是可以的，像我这种中度游戏的一天两充完全可以满足。
期待七月份吓人的更新！！！",5,首先给物流点一个赞，真的非常的快(//∇//)我昨天晚上下的单，今天下午就到了 手机在外观方面特别好看，后盖的极光渐变色（好像是这么叫的吧）完全俘获了我这颗少男心(?>?<?） 手机运行方面非常流畅，日常运行方面970处理器完全够用。 还有散热方面，几局王者荣耀跟吃鸡下来，也并没有跟网上喷子说的那样烫手！！ 电量的话3400毫安电池，平时不怎么玩游戏的话，一天一充还是可以的，像我这种中度游戏的一天两充完全可以满足。 期待七月份吓人的更新！！！,0,,-1
6176077,comment,不知道效果如何，买给我妈妈的，我妈说还不错，平时就打打电话，玩玩微信，不玩游戏应该挺好,5,不知道效果如何，买给我妈妈的，我妈说还不错，平时就打打电话，玩玩微信，不玩游戏应该挺好,0,,-1
28409652238,comment,还可以，但有股味道，不知道为什么,5,还可以，但有股味道，不知道为什么,0,,1
3901175,comment,买了一个星期就被偷了，手机还不错，不能玩吃鸡，还不错,3,买了一个星期就被偷了，手机还不错，不能玩吃鸡，还不错,0,,-1
6610412,comment,机子价格比较优惠，但还是退了！赞下京东的七天包退服务！接下来说下原因，一屏幕怪中间、有个摄像头，看视频会缺个角，他的返回设置键没设在指纹那排而是屏上，无形中占的屏幕，所以可用屏幕不大，怪怪的、二。电池，老婆说看两小时视频就没电，没他原来小米好用！三速度，6G的内存，她说有时卡顿！,5,机子价格比较优惠，但还是退了！赞下京东的七天包退服务！接下来说下原因，一屏幕怪中间、有个摄像头，看视频会缺个角，他的返回设置键没设在指纹那排而是屏上，无形中占的屏幕，所以可用屏幕不大，怪怪的、二。电池，老婆说看两小时视频就没电，没他原来小米好用！三速度，6G的内存，她说有时卡顿！,0,,-1
21845662740,comment,手机收到了用了一天总体还不错速度还可以,5,手机收到了用了一天总体还不错速度还可以,0,,7
25531193076,comment,实物与宣传不符，物流非常慢，再三催促之下，6天才到货！服务态度很流氓，只是在短信上跟你磨牙，不办事！好心建议大家:远离此店！！！,5,实物与宣传不符，物流非常慢，再三催促之下，6天才到货！服务态度很流氓，只是在短信上跟你磨牙，不办事！好心建议大家:远离此店！！！,0,,34
12764636413,comment,小米手机非常好，实用很容易上手，以后还选这个品牌,5,小米手机非常好，实用很容易上手，以后还选这个品牌,0,,0
22863264117,comment,不错，支持国产手机,5,不错，支持国产手机,0,,2
29638202857,comment,十五号下单十九号才到电池不耐用我也是醉,5,十五号下单十九号才到电池不耐用我也是醉,0,,4
25158905369,comment,很好，是正品。,5,很好，是正品。,0,,-1
7479912,comment,屏幕像素比我的荣耀9低，电池不耐用，屏大配置高。,5,屏幕像素比我的荣耀9低，电池不耐用，屏大配置高。,0,,3
20349124505,comment,宝贝今天收到啦，很满意，给的赠品也很好，下次还会来买的，支持国产，好评。_,5,宝贝今天收到啦，很满意，给的赠品也很好，下次还会来买的，支持国产，好评。_,0,,36
30153140071,comment,华为手机还是可以的,5,华为手机还是可以的,0,,19
30323689521,comment,在京东商城买东西挺放心的，电话也很给力,5,在京东商城买东西挺放心的，电话也很给力,0,,8
7437788,comment,等了一个礼拜今天终于到了，只是包装有点简单哦！哈哈,5,等了一个礼拜今天终于到了，只是包装有点简单哦！哈哈,0,,36
28672267256,comment,荣耀的机型哪个都好用，这款颜值相当高，用起来特别流畅！,5,荣耀的机型哪个都好用，这款颜值相当高，用起来特别流畅！,0,,3
5920651,comment,过年给爸爸买的，很喜欢,5,过年给爸爸买的，很喜欢,0,,18
25774787882,comment,给丫头买的.网速快不卡.她很喜欢外观设计美观，质量用后再评吧。,5,给丫头买的.网速快不卡.她很喜欢外观设计美观，质量用后再评吧。,0,,20
8484451,comment,始于颜值，陷于才华，外观没得说，很有质感，戴上保护壳更透亮，尤其是夏天拿在手上一定够档次。,5,始于颜值，陷于才华，外观没得说，很有质感，戴上保护壳更透亮，尤其是夏天拿在手上一定够档次。,0,,25
7534113,comment,用着还可以，这个价位手机功能很不错啦，大家值得买,5,用着还可以，这个价位手机功能很不错啦，大家值得买,0,,2
8239683,comment,很好&hellip;&hellip;用着速度挺快,5,很好……用着速度挺快,0,,11
29242522476,comment,手机很喜欢，价格很实惠，外观大气，性价比高，运行流畅，是正品,5,手机很喜欢，价格很实惠，外观大气，性价比高，运行流畅，是正品,0,,2
5853593,comment,两次售后申请如下：①16号下的单，今天刚收到的手机，一打开，全是灰尘。本来以为只是快递运输过程中不小心把灰尘弄到包装盒表面了。可是撕开包装盒表面塑料薄膜打开包装一看，里面还是很多灰尘。打开包装盒拿出手机，手机屏幕表面很多指纹手印，而且包装盒都是折痕，尤其是那个放取卡针的地方折痕尤其明显。再认真看充电口，发现充电口里头有条白色的塑料条。而且充电口里面被白色塑料条顶得拱起来变形了，最气人的是指纹下面的屏幕边缘居然有磨损和小裂纹。把别人用过的二手货发给我，亏我一直支持京东，网购都选择京东自营。真的是太气人了。我申请换货，不要再发破损的二手货给我了。不然直接退货退款。②再次反馈一下问题。只是反馈问题，因为没有其他渠道能上传图片，所以才来这个渠道。手机既不用退换货也不用维修。我只是借这个渠道反馈问题而已。申请换货后，今天收到货了，打开包装后，检查了一下手机，手机这次没问题。但是内部包装有问题，明显被人动过了，你们自己看这上传的图片，因为限制只能发一张，所以发了这样最明显的。说明书和TPU保护壳等本来应该放在袋子里的东西都被拿出来了。放取卡针的地方有明显折痕。放充电器接头的地方完全被压塌且破损。,1,两次售后申请如下：①16号下的单，今天刚收到的手机，一打开，全是灰尘。本来以为只是快递运输过程中不小心把灰尘弄到包装盒表面了。可是撕开包装盒表面塑料薄膜打开包装一看，里面还是很多灰尘。打开包装盒拿出手机，手机屏幕表面很多指纹手印，而且包装盒都是折痕，尤其是那个放取卡针的地方折痕尤其明显。再认真看充电口，发现充电口里头有条白色的塑料条。而且充电口里面被白色塑料条顶得拱起来变形了，最气人的是指纹下面的屏幕边缘居然有磨损和小裂纹。把别人用过的二手货发给我，亏我一直支持京东，网购都选择京东自营。真的是太气人了。我申请换货，不要再发破损的二手货给我了。不然直接退货退款。②再次反馈一下问题。只是反馈问题，因为没有其他渠道能上传图片，所以才来这个渠道。手机既不用退换货也不用维修。我只是借这个渠道反馈问题而已。申请换货后，今天收到货了，打开包装后，检查了一下手机，手机这次没问题。但是内部包装有问题，明显被人动过了，你们自己看这上传的图片，因为限制只能发一张，所以发了这样最明显的。说明书和TPU保护壳等本来应该放在袋子里的东西都被拿出来了。放取卡针的地方有明显折痕。放充电器接头的地方完全被压塌且破损。,0,,29
26266694915,comment,刚开始挑选时，看到6.28英寸，还担心太大不好使用。外观很漂亮，手感很好。自己买了后，朋友看到试用效果好，让我也帮忙订了一款。,5,刚开始挑选时，看到6.28英寸，还担心太大不好使用。外观很漂亮，手感很好。自己买了后，朋友看到试用效果好，让我也帮忙订了一款。,0,,-1
5402840,comment,送老人家的，好像不错！,5,送老人家的，好像不错！,0,,14
7651903,comment,雷老板出的小米手机我还是很信任的，红米手机系列的价格是让我们这些学生族非常能接受的，电池非常耐用，各方面的性能远远超过了这个价位，物流更是没得说，头一天晚上下单，第二天中午就到了，总之，非常棒棒哒！,5,雷老板出的小米手机我还是很信任的，红米手机系列的价格是让我们这些学生族非常能接受的，电池非常耐用，各方面的性能远远超过了这个价位，物流更是没得说，头一天晚上下单，第二天中午就到了，总之，非常棒棒哒！,0,,0
15612619462,comment,手机不错，触屏挺灵的，外观也好看！性价比高,5,手机不错，触屏挺灵的，外观也好看！性价比高,0,,2
29619588672,comment,能开空调电量打是我最喜欢的，手机其实还是比较卡的，,5,能开空调电量打是我最喜欢的，手机其实还是比较卡的，,0,,-1
21135280362,comment,产品很不错使用还可以,5,产品很不错使用还可以,0,,1
7694047,comment,"目前没有什么不好的手感什么的不错使用也不错质量非常好，与卖家描述的完全一致，非常满意,真的很喜欢，完全超出期望值，发货速度非常快，包装非常仔细、严实，物流公司服务态度很好，运送速度很快，很满意的一次购物很多时候高颜值往往只跟高价的旗舰机相匹配，而千元机基本没有什么看点，大部分都是入门的配置和平庸的设计，然而最近发布的荣耀9i，相信这是会改变了很多人以往的看法。荣耀9i将于7月支持GPU Turbo，大家可以试试。",5,"目前没有什么不好的手感什么的不错使用也不错质量非常好，与卖家描述的完全一致，非常满意,真的很喜欢，完全超出期望值，发货速度非常快，包装非常仔细、严实，物流公司服务态度很好，运送速度很快，很满意的一次购物很多时候高颜值往往只跟高价的旗舰机相匹配，而千元机基本没有什么看点，大部分都是入门的配置和平庸的设计，然而最近发布的荣耀9i，相信这是会改变了很多人以往的看法。荣耀9i将于7月支持GPU Turbo，大家可以试试。",0,,-1
7846413,comment,黑色真漂亮，满满苹果x的知道，就是到货时间太久了,5,黑色真漂亮，满满苹果x的知道，就是到货时间太久了,0,,6
11107032701,comment,接个视频半天都反应不过来,5,接个视频半天都反应不过来,0,,-1
26263258528,comment,屏幕挺大的，手感不错，壳就是有点松,5,屏幕挺大的，手感不错，壳就是有点松,0,,-1
5019352,comment,给老爷子买的，到目前为止很满意。,5,给老爷子买的，到目前为止很满意。,0,,14
7651927,comment,第一次购买的，网络信号弱，换了一部新的。颜值也不错。给妈妈买的。她挺满意！,5,第一次购买的，网络信号弱，换了一部新的。颜值也不错。给妈妈买的。她挺满意！,0,,20
29196113704,comment,喜欢小米这个品牌，性价比高，对于老人家来说完全够用,5,喜欢小米这个品牌，性价比高，对于老人家来说完全够用,0,,0
16290978197,comment,用了几天来评价，这款机子的性价比挺高的，给个好评，店家也比较实在，送的东西挺多；特别是有一年的保修服务和一年的影视会员；,5,用了几天来评价，这款机子的性价比挺高的，给个好评，店家也比较实在，送的东西挺多；特别是有一年的保修服务和一年的影视会员；,0,,-1
28714523786,comment,到安徽隔天就收到，物流太快了，手机看着很好，比实体店便宜，希望耐用,5,到安徽隔天就收到，物流太快了，手机看着很好，比实体店便宜，希望耐用,0,,7
5375693,comment,感觉还是满好的，用起也好用。,5,感觉还是满好的，用起也好用。,0,,1
21845662740,comment,使用中，后期在来评,5,使用中，后期在来评,0,,1
25531193076,comment,从订单到送达，总共才一天半时间，今早八点多就送到我小区快递柜。很快，谢谢你们。还没用，应该很好，我相信！,5,从订单到送达，总共才一天半时间，今早八点多就送到我小区快递柜。很快，谢谢你们。还没用，应该很好，我相信！,0,,5
28328600610,comment,很快就收到货了，仔细看过，外包装膜有点粗糙，手机屏是裸屏，串号查过，保修状态查过，到售后也问了一下，一切都没有问题，总之便宜实惠，老人用很合适！用用观察一下再末评价！,5,很快就收到货了，仔细看过，外包装膜有点粗糙，手机屏是裸屏，串号查过，保修状态查过，到售后也问了一下，一切都没有问题，总之便宜实惠，老人用很合适！用用观察一下再末评价！,0,,-1
5663902,comment,电池续航能力很强,5,电池续航能力很强,0,,4
11339519481,comment,手机给我妈买的，她说挺好的，蛮喜欢的,5,手机给我妈买的，她说挺好的，蛮喜欢的,0,,20
5942439,comment,"质量不行，买回来几天喇叭就坏了。
也不知道联系谁？看看能不能修？",5,质量不行，买回来几天喇叭就坏了。 也不知道联系谁？看看能不能修？,0,,-1
26697273746,comment,可以，什么都好用,5,可以，什么都好用,0,,1
12764636413,comment,是正品，不错。也很流畅，不愧为小米最精典手机,5,是正品，不错。也很流畅，不愧为小米最精典手机,0,,0
22863264117,comment,还行，用着感觉还不错,5,还行，用着感觉还不错,0,,1
29638202857,comment,运行速度还行，就是有时有点卡。,5,运行速度还行，就是有时有点卡。,0,,43
25158905369,comment,挺好的这手机,5,挺好的这手机,0,,2
