sku_id,item_name,content,score,clean_content,is_spam,spam_reason,topic_id
8484451,comment,真机比网上图片更好看，手感也很好，使用一段时间再来评价,5,真机比网上图片更好看，手感也很好，使用一段时间再来评价,0,,-1
7694047,comment,"个方面还行吧
挺满意的
就是没出厂膜
其他的可以
不卡顿",5,个方面还行吧 挺满意的 就是没出厂膜 其他的可以 不卡顿,0,,-1
7846413,comment,手机挺好的，买的高配版。运行流畅，性价比高，但是说实话性能过剩，系统不如蓝绿大厂的精致流畅，有些bug。望以后加强。,5,手机挺好的，买的高配版。运行流畅，性价比高，但是说实话性能过剩，系统不如蓝绿大厂的精致流畅，有些bug。望以后加强。,0,,-1
5853593,comment,19号早上下的单，商品页面显示预计31号之后才有货，物流一直显示采购中，等得我比较担心?。但是意外的是23号早晨起来一看发现已经发货啦?，从外省发过来第二天早上收到。用了两天，感觉真的很不错。屏幕够大，看着舒服。外观实在是很喜欢，机身、颜色很漂亮，配上了一个自己买的*块的黑色外壳（自带的总觉得不好看?），手感、颜值都没的说，而且加了壳之后，摄像头的凸起也不醒目了，我感觉反而有点像大眼萌?。性能不错，指纹解锁也很快。。。。。。关于网上好些人讲屏幕颗粒感什么的，买的时候也比较揪心，不过拿到手后，确实没发现屏幕有什么问题，我平时喜欢看看视频什么的，看习惯了平板，除了屏幕小一点，没觉得有什么不适应的，可能部分网友说得夸张了点吧。。。?目前手机还没有发现问题，出问题我还会及时反馈的??,5,19号早上下的单，商品页面显示预计31号之后才有货，物流一直显示采购中，等得我比较担心?。但是意外的是23号早晨起来一看发现已经发货啦?，从外省发过来第二天早上收到。用了两天，感觉真的很不错。屏幕够大，看着舒服。外观实在是很喜欢，机身、颜色很漂亮，配上了一个自己买的*块的黑色外壳（自带的总觉得不好看?），手感、颜值都没的说，而且加了壳之后，摄像头的凸起也不醒目了，我感觉反而有点像大眼萌?。性能不错，指纹解锁也很快。。。。。。关于网上好些人讲屏幕颗粒感什么的，买的时候也比较揪心，不过拿到手后，确实没发现屏幕有什么问题，我平时喜欢看看视频什么的，看习惯了平板，除了屏幕小一点，没觉得有什么不适应的，可能部分网友说得夸张了点吧。。。?目前手机还没有发现问题，出问题我还会及时反馈的??,0,,9
7651927,comment,手机很好很不错，也挺好看的，挺好用的,5,手机很好很不错，也挺好看的，挺好用的,0,,2
7321794,comment,"拍照效果没试&hellip;因为自己对手机拍照没什么要求&hellip;不过这个价格肯定很厉害了！到手一天多了，该装的软件也都装上了，也使用了一些功能，不得不说毕竟小旗舰，运行速度上真的是没话说，指纹解锁人脸识别什么的就不说了，真的很好用。扫码付款扫码登录什么的速度快到无情&hellip;而且这手机手感真的很好，大小厚度什么的都好。电量的话，没重度使用过不好说，但是前一个手机就是电池炸了才换的，这个肯定要注意一点了。618买的，其实之前纠结这个还是三星s8+，最终还是选择了这个，用了一天的结论是:很满意！
另外京东的物流得赞一下&hellip;真快，头天上午下单，第二天中午拿到了&hellip;",5,拍照效果没试…因为自己对手机拍照没什么要求…不过这个价格肯定很厉害了！到手一天多了，该装的软件也都装上了，也使用了一些功能，不得不说毕竟小旗舰，运行速度上真的是没话说，指纹解锁人脸识别什么的就不说了，真的很好用。扫码付款扫码登录什么的速度快到无情…而且这手机手感真的很好，大小厚度什么的都好。电量的话，没重度使用过不好说，但是前一个手机就是电池炸了才换的，这个肯定要注意一点了。618买的，其实之前纠结这个还是三星s8+，最终还是选择了这个，用了一天的结论是:很满意！ 另外京东的物流得赞一下…真快，头天上午下单，第二天中午拿到了…,0,,-1
7437768,comment,到货速度很快 就是像素不是很高,5,到货速度很快 就是像素不是很高,0,,38
8344046,comment,给五星好评！服务好、手机不错、款式漂亮，全面屏，一看就喜欢，手感特别好。开机后给我的感觉特别好，画面清晰细腻，色彩饱和度很高！冲着这个价格的手机这里就可以给五星。性价比强劲，2000内这个配置，性价比强劲，而且卖家还有优惠券领取，实在是很优惠，指纹解锁速度很快，尝试了一下AI人脸识别，感觉解锁速度也足够快，软件都可以卸载，没有多余的插件和应用，6+128G绝对够用！,5,给五星好评！服务好、手机不错、款式漂亮，全面屏，一看就喜欢，手感特别好。开机后给我的感觉特别好，画面清晰细腻，色彩饱和度很高！冲着这个价格的手机这里就可以给五星。性价比强劲，2000内这个配置，性价比强劲，而且卖家还有优惠券领取，实在是很优惠，指纹解锁速度很快，尝试了一下AI人脸识别，感觉解锁速度也足够快，软件都可以卸载，没有多余的插件和应用，6+128G绝对够用！,0,,-1
3901175,comment,不错，上网速度稍微慢一点。如果这个价位也可以了。,5,不错，上网速度稍微慢一点。如果这个价位也可以了。,0,,43
6176077,comment,"这是一款不错的低价手机啊!物流派送速度很快，包装完美，还有配件齐全，软壳很好，有缓冲作用，小巧玲珑，性能稳定，这样的价位有这样的配置很好了,价廉物美，经济实 惠，值得推荐。",5,"这是一款不错的低价手机啊!物流派送速度很快，包装完美，还有配件齐全，软壳很好，有缓冲作用，小巧玲珑，性能稳定，这样的价位有这样的配置很好了,价廉物美，经济实 惠，值得推荐。",0,,-1
8240587,comment,等这机等得很心急，手机拿到手就马上拆开体验一下，手感很好，屏幕很清晰，用起来很流畅，还玩了一把吃鸡，感觉没卡顿，比我的note5好用多了，看来是买对了。电池有3750毫安，续航能力应该会不错，我同事用的荣耀9玩游戏都可以用一天多,5,等这机等得很心急，手机拿到手就马上拆开体验一下，手感很好，屏幕很清晰，用起来很流畅，还玩了一把吃鸡，感觉没卡顿，比我的note5好用多了，看来是买对了。电池有3750毫安，续航能力应该会不错，我同事用的荣耀9玩游戏都可以用一天多,0,,3
5001213,comment,送给老公的升职加薪礼物，他非常喜欢，全面屏很棒啊！,5,送给老公的升职加薪礼物，他非常喜欢，全面屏很棒啊！,0,,18
5089275,comment,京东买的第三台苹果 苹果粉 换了新机感觉很好 苹果4s之后一直在等全玻璃身的机型，?还是等到成熟了再买 不介意等多一年买新款的全面屏。,5,京东买的第三台苹果 苹果粉 换了新机感觉很好 苹果4s之后一直在等全玻璃身的机型，?还是等到成熟了再买 不介意等多一年买新款的全面屏。,0,,6
7081550,comment,"是一次很愉快的购物，先说我不是抢手也不爱评价写很多字，几乎不晒单。我本来预算就不多，想买个性价比好的手机，考虑过v10,可两个大眼睛让我却步，真不好看，正好新机出来了，咬牙买的，收货不方便，京东快递大哥特地给我送了2次，很感谢，怀着忐忑的心拆开包装，惊艳，完全不输于p20.很漂亮，手感很好，也奇怪为什么网上对它的外观评价不好，，，，，屏幕画质很好，拍照很棒，可惜我在网上买了手机壳，手机自带手机壳和贴膜，哎，说明咋不写呢，外放音乐一般，其他没有测试，绝对值得入手。",5,"是一次很愉快的购物，先说我不是抢手也不爱评价写很多字，几乎不晒单。我本来预算就不多，想买个性价比好的手机，考虑过v10,可两个大眼睛让我却步，真不好看，正好新机出来了，咬牙买的，收货不方便，京东快递大哥特地给我送了2次，很感谢，怀着忐忑的心拆开包装，惊艳，完全不输于p20.很漂亮，手感很好，也奇怪为什么网上对它的外观评价不好，，，，，屏幕画质很好，拍照很棒，可惜我在网上买了手机壳，手机自带手机壳和贴膜，哎，说明咋不写呢，外放音乐一般，其他没有测试，绝对值得入手。",0,,9
5089267,comment,物流很快 一天就收到了，还没打开 准备送人了,5,物流很快 一天就收到了，还没打开 准备送人了,0,,5
7283905,comment,这个手机只能给4星，我来说说原因吧，第一是外形，后面镜头太凸出了，相信你们网上都看了。第二是全屏的不好一点，其实全屏并没什么用，而且在看视频的时候两边是黑的只有中间一块是视频，下面有图可以证明。第三是充电，我把电量用到4%后进行了测试，下面图片有测试记录。要一小时40分钟才能充满，大概一分钟1%的电量输入。在充电插进去的时候，那个头子可以摇动，我不知道只有我一个手机这样还是全部这样。对耗电我没有测试，我拿到手机时有50%电我只用了3个小时左右就没电了。重度用户慎入坑。第四是全屏模式的时候好多功能没有，没有功能键，如小爱同学语音，截屏之类的都只能点屏幕上面的图标才行。第五是拍照并没有发布会说的那么好，并不好用。我这里说了很多缺点，这都是事实存在的，这个手机也有优点，杨柳腰的握感是真的挺棒，黑色的机子也很好看，价格便宜，我更加推荐买小米noto3，因为我家人有一部，所以我才买的6X。说了这么多是因为我买之前也看评论，结果别人说的都太少了，我才在这里说这么多给广发消费者一个建议，有什么问题可以找我提问。因为字数限制就不说了。荆轲刺秦王,4,这个手机只能给4星，我来说说原因吧，第一是外形，后面镜头太凸出了，相信你们网上都看了。第二是全屏的不好一点，其实全屏并没什么用，而且在看视频的时候两边是黑的只有中间一块是视频，下面有图可以证明。第三是充电，我把电量用到4%后进行了测试，下面图片有测试记录。要一小时40分钟才能充满，大概一分钟1%的电量输入。在充电插进去的时候，那个头子可以摇动，我不知道只有我一个手机这样还是全部这样。对耗电我没有测试，我拿到手机时有50%电我只用了3个小时左右就没电了。重度用户慎入坑。第四是全屏模式的时候好多功能没有，没有功能键，如小爱同学语音，截屏之类的都只能点屏幕上面的图标才行。第五是拍照并没有发布会说的那么好，并不好用。我这里说了很多缺点，这都是事实存在的，这个手机也有优点，杨柳腰的握感是真的挺棒，黑色的机子也很好看，价格便宜，我更加推荐买小米noto3，因为我家人有一部，所以我才买的6X。说了这么多是因为我买之前也看评论，结果别人说的都太少了，我才在这里说这么多给广发消费者一个建议，有什么问题可以找我提问。因为字数限制就不说了。荆轲刺秦王,0,,10
5089253,comment,今天能才用上，6号到的货，一直都没有货有也抢不到，6号凌晨换了个地址居然北京有货，立马下单当天就到了，然后叫朋友再寄顺丰过来很快就一天，用得6p太卡了所以换个新款 总体还可以 好评 ！,5,今天能才用上，6号到的货，一直都没有货有也抢不到，6号凌晨换了个地址居然北京有货，立马下单当天就到了，然后叫朋友再寄顺丰过来很快就一天，用得6p太卡了所以换个新款 总体还可以 好评 ！,0,,-1
7534113,comment,给妈妈买的 屏幕大小不错 适合需要带花镜的人士 其他功能没怎么用还不知道怎么样 感觉应该不错吧,5,给妈妈买的 屏幕大小不错 适合需要带花镜的人士 其他功能没怎么用还不知道怎么样 感觉应该不错吧,0,,20
7479912,comment,首先手机屏幕显示效果还可以，没有像网友们说的那么不堪，但显示效果确实没有小米8SE三星屏幕艳丽，但国产天马屏也还好了。拍照效果不错，原本以为就是游戏手机呢拍照一般，但出乎我的意外。刘海屏不错可以隐藏，打游戏很爽，但还是会发热的，不是太严重。电池也还可以。但充电比较慢，没有电的情况要两个多小时才能充满，快充不给力还是弱，跑分二十万多点，系统流畅性价比高，华为荣耀值得信赖！,5,首先手机屏幕显示效果还可以，没有像网友们说的那么不堪，但显示效果确实没有小米8SE三星屏幕艳丽，但国产天马屏也还好了。拍照效果不错，原本以为就是游戏手机呢拍照一般，但出乎我的意外。刘海屏不错可以隐藏，打游戏很爽，但还是会发热的，不是太严重。电池也还可以。但充电比较慢，没有电的情况要两个多小时才能充满，快充不给力还是弱，跑分二十万多点，系统流畅性价比高，华为荣耀值得信赖！,0,,10
5942439,comment,不不饿给老年 red 用 声音大 好操作,5,不不饿给老年 red 用 声音大 好操作,0,,12
5663902,comment,"优点：颜值很高，轻薄，这个价位很值。
缺点：不是特别流畅，偶尔反应有半秒到一秒的延迟，就是不知道都是这样还是我的运气问题。
    总结：作为花粉忠实用户，此款手机的亮点就是全面屏，其它方面不讲数据单讲使用体验表现皆较平慵。当然千元机非要旗舰机的体验是不可能的。在性能上和朋友这个价位还的魅族note6比不过，但颜值是完胜魅族。其它同价位的我也没参照物就不讲了",5,优点：颜值很高，轻薄，这个价位很值。 缺点：不是特别流畅，偶尔反应有半秒到一秒的延迟，就是不知道都是这样还是我的运气问题。 总结：作为花粉忠实用户，此款手机的亮点就是全面屏，其它方面不讲数据单讲使用体验表现皆较平慵。当然千元机非要旗舰机的体验是不可能的。在性能上和朋友这个价位还的魅族note6比不过，但颜值是完胜魅族。其它同价位的我也没参照物就不讲了,0,,-1
5402840,comment,手机反应挺快，按键够大按起来也舒服，手机看起来很大气。售后服务很满意，这个很赞?,5,手机反应挺快，按键够大按起来也舒服，手机看起来很大气。售后服务很满意，这个很赞?,0,,-1
7437788,comment,买的不是手机，是期货啊：618零点抢到还挺美，没成想早上起来才发现写着25号发货，心中千万只神兽咆哮而过啊，关键是手机摔碎了屏速度还慢，多用一分钟都是煎熬啊啊啊啊！等了三天实在忍不了了，联系京东客服，发了几句牢骚，结果22号凌晨出库了，24号晚7点四十终于到手，带着久违的激动开了箱：机器做工还可以吧，完美主义者就算了，或者你像我一样外面套上，起码看不到所谓的插纸缝；反应速度很不错，128的存储空间也足够了（装了一堆软件还剩107g，日常使用足矣）；面部识别比较快，不过需要先亮屏（设置翻转亮屏就好）；删了一些自带程序安逸多了，虽然还有些不让卸；5小时轻度使用掉了30%的电，重度使用估计能撑大半天8到10小时吧，充电比较快，90分钟左右；跑了27万分，据说升级miui10就能过30万，懒得折腾了，等官方推送正式版吧；花了几块钱下了个x的主题，还挺像哈哈。除了买和收货不太爽，总体满意，毕竟不加价买到这配置还是性价比极高的。,5,买的不是手机，是期货啊：618零点抢到还挺美，没成想早上起来才发现写着25号发货，心中千万只神兽咆哮而过啊，关键是手机摔碎了屏速度还慢，多用一分钟都是煎熬啊啊啊啊！等了三天实在忍不了了，联系京东客服，发了几句牢骚，结果22号凌晨出库了，24号晚7点四十终于到手，带着久违的激动开了箱：机器做工还可以吧，完美主义者就算了，或者你像我一样外面套上，起码看不到所谓的插纸缝；反应速度很不错，128的存储空间也足够了（装了一堆软件还剩107g，日常使用足矣）；面部识别比较快，不过需要先亮屏（设置翻转亮屏就好）；删了一些自带程序安逸多了，虽然还有些不让卸；5小时轻度使用掉了30%的电，重度使用估计能撑大半天8到10小时吧，充电比较快，90分钟左右；跑了27万分，据说升级miui10就能过30万，懒得折腾了，等官方推送正式版吧；花了几块钱下了个x的主题，还挺像哈哈。除了买和收货不太爽，总体满意，毕竟不加价买到这配置还是性价比极高的。,0,,9
8484451,comment,发货很快啊，中午下的订单，下午就到了，哈哈，神速，包装完好无损，是行货,5,发货很快啊，中午下的订单，下午就到了，哈哈，神速，包装完好无损，是行货,0,,5
8239683,comment,外观真心非常漂亮，流光溢彩的视觉感受，真的非常棒，很少见到怎么漂亮的手机了，功能各方面都是非常不错的，性能很高，拍照清晰，还可以趣味拍照，非常不错，就是冲着强大的功能和外观下单的，真的非常值得，店家服务很棒，发货及时，客服MM态度很棒，有问必答，真的非常不错，性价比很高的手机，大赞，支持辣椒！,5,外观真心非常漂亮，流光溢彩的视觉感受，真的非常棒，很少见到怎么漂亮的手机了，功能各方面都是非常不错的，性能很高，拍照清晰，还可以趣味拍照，非常不错，就是冲着强大的功能和外观下单的，真的非常值得，店家服务很棒，发货及时，客服MM态度很棒，有问必答，真的非常不错，性价比很高的手机，大赞，支持辣椒！,0,,-1
5853593,comment,华为荣耀Ｖ10　大屏，屏比合理，虽然是5.9，但手持和5.5的屏一样宽，女士用很适合，1080的分辨率最好，我原用的是2Ｋ屏，那叫一个费电，后悔莫及。机器自启程序很多，我也懒着关，因为不影响速度，运行很快的，自带的手机防盗定位功能，我试了一下，在电脑上就可以查到手机的位置，且不用开ＧＰＳ，手机带ＮＦＣ功能。可以刷各种卡，我还没试过。后双摄，太清楚了，原来在暗的地方手机照不了的地方，用这部手机照很清楚，超满意。就是拍下两天以后才发，发货慢了点，商家说这款红色没有了得从商家现调货才发，好在快递还挺快。与描述的相符。本评论实事求是，不会违心评价。总之，性价比不错，支持国产。,5,华为荣耀Ｖ10 大屏，屏比合理，虽然是5.9，但手持和5.5的屏一样宽，女士用很适合，1080的分辨率最好，我原用的是2Ｋ屏，那叫一个费电，后悔莫及。机器自启程序很多，我也懒着关，因为不影响速度，运行很快的，自带的手机防盗定位功能，我试了一下，在电脑上就可以查到手机的位置，且不用开ＧＰＳ，手机带ＮＦＣ功能。可以刷各种卡，我还没试过。后双摄，太清楚了，原来在暗的地方手机照不了的地方，用这部手机照很清楚，超满意。就是拍下两天以后才发，发货慢了点，商家说这款红色没有了得从商家现调货才发，好在快递还挺快。与描述的相符。本评论实事求是，不会违心评价。总之，性价比不错，支持国产。,0,,3
7651927,comment,冲着百元机的全面屏去，还是蛮不错的。日常使用还凑合。当然了，预算够还是推荐买更好的。,5,冲着百元机的全面屏去，还是蛮不错的。日常使用还凑合。当然了，预算够还是推荐买更好的。,0,,-1
7321794,comment,手机质量很好，系统运行流畅，拍照清晰，外观设计漂亮。,5,手机质量很好，系统运行流畅，拍照清晰，外观设计漂亮。,0,,2
7651903,comment,给儿子买了一个，闺女也要一个，一共买了两个了，速度很快，使用也可以，京东电子产品值得信任，还会继续关注。家里除了苹果就是小米了，哈哈,5,给儿子买了一个，闺女也要一个，一共买了两个了，速度很快，使用也可以，京东电子产品值得信任，还会继续关注。家里除了苹果就是小米了，哈哈,0,,0
7437768,comment,非常高大上，物美廉价,5,非常高大上，物美廉价,0,,23
5375693,comment,给爸爸买的 用着挺好的也很喜欢 下次还会再来回购的 电灯比较便捷很好,5,给爸爸买的 用着挺好的也很喜欢 下次还会再来回购的 电灯比较便捷很好,0,,18
19078286246,comment,昨天下午就收到了，手机和网上描述的一样，很漂亮够大气，是正品，性价比高，值得拥有！京东送货够快的，比预期提前一天送达，京东商城，值得信赖！,5,昨天下午就收到了，手机和网上描述的一样，很漂亮够大气，是正品，性价比高，值得拥有！京东送货够快的，比预期提前一天送达，京东商城，值得信赖！,0,,13
8344046,comment,小辣椒R15手机是我待其他竞品的对比下选择购买的，最终我留下了R15。心得：1.3000毫安大容量电池，电池续航能力强，待机时间2天没毛病，玩游戏看视频畅聊待机也超一整天。这是对于一个不坐办公室的商务人员最重要的，之前我用的是小米，充完电用5-6个小时最多了，同等使用，这个手机能用18~24个小时。直接卸下每天带充电宝的累赘。2.6.20英寸全面大屏，单手可以操作，低于5.5寸我是真不考虑了，作为一个手机控（手机屏幕太小）且不做办公室（主要户外使用）。3，像素1600万+500万拍照图片视频摄像调校OK：色彩清晰明艳，拍照时间反应短，都离不开手机拍照摄像功能，所以清晰度分辨率首当其冲。全面屏、微信多开、新一代AI红外人像解锁、无线充电、6+128G大内存，运行流畅，前置1600W像素还支持全景模式，没想到能做到这个高度。4、而且价格只要1899元，实在很实惠。,5,小辣椒R15手机是我待其他竞品的对比下选择购买的，最终我留下了R15。心得：1.3000毫安大容量电池，电池续航能力强，待机时间2天没毛病，玩游戏看视频畅聊待机也超一整天。这是对于一个不坐办公室的商务人员最重要的，之前我用的是小米，充完电用5-6个小时最多了，同等使用，这个手机能用18~24个小时。直接卸下每天带充电宝的累赘。2.6.20英寸全面大屏，单手可以操作，低于5.5寸我是真不考虑了，作为一个手机控（手机屏幕太小）且不做办公室（主要户外使用）。3，像素1600万+500万拍照图片视频摄像调校OK：色彩清晰明艳，拍照时间反应短，都离不开手机拍照摄像功能，所以清晰度分辨率首当其冲。全面屏、微信多开、新一代AI红外人像解锁、无线充电、6+128G大内存，运行流畅，前置1600W像素还支持全景模式，没想到能做到这个高度。4、而且价格只要1899元，实在很实惠。,0,,4
3901175,comment,性价比没得说！好评！！！！,5,性价比没得说！好评！！！！,0,,1
6176077,comment,第一次从网上买手机，昨天买今天就到了，京东这物流太快了，反应挺快，准备再买一个给老公用,5,第一次从网上买手机，昨天买今天就到了，京东这物流太快了，反应挺快，准备再买一个给老公用,0,,-1
