sku_id,item_name,content,score,clean_content,is_spam,spam_reason,topic_id
7437788,comment,说实话，18号订单今天到了，还是超出预期了。京东送货都是很快的，6天才到，我想是供应商没有货的原因吧。感觉等得很心塞。不过拿到手机那一刻，确实很惊喜，之前没有用过小米手机，这次也是第一次关注，8周年的小米，确实性价比很高，虽然在做工上还可以更好。手机整体外观和性能都是上上之选，没有最好的，只有适合自己的，即使大家都说模仿苹果，其实不尽然，只是很多技术还不成熟，尤其是刘海那个位置很多手机元件不好设计和安置，所以采取了刘海屏，没看到现在的刘海屏大军吗？未来肯定都会走全面屏，保证屏幕占比同时，让前置拍照等技术越来越来先进，希望国产手机越做越好，出口到世界各地！总之对小米8很满意,5,说实话，18号订单今天到了，还是超出预期了。京东送货都是很快的，6天才到，我想是供应商没有货的原因吧。感觉等得很心塞。不过拿到手机那一刻，确实很惊喜，之前没有用过小米手机，这次也是第一次关注，8周年的小米，确实性价比很高，虽然在做工上还可以更好。手机整体外观和性能都是上上之选，没有最好的，只有适合自己的，即使大家都说模仿苹果，其实不尽然，只是很多技术还不成熟，尤其是刘海那个位置很多手机元件不好设计和安置，所以采取了刘海屏，没看到现在的刘海屏大军吗？未来肯定都会走全面屏，保证屏幕占比同时，让前置拍照等技术越来越来先进，希望国产手机越做越好，出口到世界各地！总之对小米8很满意,0,,0
25774787882,comment,完美，完美，完美，客服很有耐心，很幽默，东西到了之后迫不及待的打开，还赠送了充电宝，小音响，自拍杆。????,5,完美，完美，完美，客服很有耐心，很幽默，东西到了之后迫不及待的打开，还赠送了充电宝，小音响，自拍杆。????,0,,-1
8484451,comment,看到朋友拿的，觉得很好看，朋友说挺好用的，一问价格简直惊到我了，刚好需要一个备用机，感觉不错，至少拿上很有面子，功能强大。,5,看到朋友拿的，觉得很好看，朋友说挺好用的，一问价格简直惊到我了，刚好需要一个备用机，感觉不错，至少拿上很有面子，功能强大。,0,,-1
7694047,comment,中午送到的。关注这款手机有段时间了，外甥女说要买手机，按她要求，自然第一时间推荐，信手拈来。打开，插卡，设置，步步流畅，反应迅捷。刷脸，刘海屏，全屏流行元素基本都带，拿在手里信心满满，选东西，要选适合自己的才是选得对。昨天下单，今天就收到，是选京东很大一部分优势。,5,中午送到的。关注这款手机有段时间了，外甥女说要买手机，按她要求，自然第一时间推荐，信手拈来。打开，插卡，设置，步步流畅，反应迅捷。刷脸，刘海屏，全屏流行元素基本都带，拿在手里信心满满，选东西，要选适合自己的才是选得对。昨天下单，今天就收到，是选京东很大一部分优势。,0,,9
7846413,comment,拿到手机地那一刻感到很值！好看！,5,拿到手机地那一刻感到很值！好看！,0,,-1
11107032701,comment,京东快递就是快，手机给妈妈买的，很好用。,5,京东快递就是快，手机给妈妈买的，很好用。,0,,8
8239683,comment,拍照很清晰，机子很流畅。,5,拍照很清晰，机子很流畅。,0,,-1
25834204287,comment,很不错 7的速度还行，不挑剔，价格也划算点,5,很不错 7的速度还行，不挑剔，价格也划算点,0,,6
5853593,comment,特意用了一个星期才过来评价的！一个字概括好?！全面屏人脸识不失潮流时尚！鲁大师跑分测试各项指标强大！游戏各种软件运行流畅不卡顿！拍照功能很?，nfc功能用起来很方便！再也不用拿着卡包出去购物刷卡！华为钱包闪付功能很好用！可以绑定8张***！能绑10张卡就最好了呵呵！用华为手机已经四年了！总之华为手机就是不错！年前给老婆买的p10plus和荣耀V10比起来还是我的V10更具有高性价比！,5,特意用了一个星期才过来评价的！一个字概括好?！全面屏人脸识不失潮流时尚！鲁大师跑分测试各项指标强大！游戏各种软件运行流畅不卡顿！拍照功能很?，nfc功能用起来很方便！再也不用拿着卡包出去购物刷卡！华为钱包闪付功能很好用！可以绑定8张***！能绑10张卡就最好了呵呵！用华为手机已经四年了！总之华为手机就是不错！年前给老婆买的p10plus和荣耀V10比起来还是我的V10更具有高性价比！,0,,-1
15612619462,comment,目前刚买回来，看着还行，应该不是二手机，用一段时间再追评,5,目前刚买回来，看着还行，应该不是二手机，用一段时间再追评,0,,32
19078286246,comment,手机样式我还是觉得可以的,5,手机样式我还是觉得可以的,0,,2
5375693,comment,按键字大，声音也很大！老人用很合适！,5,按键字大，声音也很大！老人用很合适！,0,,12
7651903,comment,手机比想象中要好看，买给老人家用，挺好的。,5,手机比想象中要好看，买给老人家用，挺好的。,0,,24
26263258528,comment,手机比较好，我习惯了用小米手机,5,手机比较好，我习惯了用小米手机,0,,0
29619588672,comment,手机很不错，是正品，送的还有耳机，指环支架，不错 不错,5,手机很不错，是正品，送的还有耳机，指环支架，不错 不错,0,,-1
5019352,comment,手机用的不错，比之前给老爸买的cool1的好用，刚好赶上活动买的就贵两百多，内存很大，不卡,5,手机用的不错，比之前给老爸买的cool1的好用，刚好赶上活动买的就贵两百多，内存很大，不卡,0,,-1
6610412,comment,外观，手感不错，屏幕颜色很好，就冲这个买的，但是***怎么就打不开呢，不同链接地址下载，先是手机应用商店然后百度上，安装了两次都是这样，一直循环，*诶。没有我会饿死啦好不好。本来是想给好评的，但是没有*用，我怎么办呢？,1,外观，手感不错，屏幕颜色很好，就冲这个买的，但是***怎么就打不开呢，不同链接地址下载，先是手机应用商店然后百度上，安装了两次都是这样，一直循环，*诶。没有我会饿死啦好不好。本来是想给好评的，但是没有*用，我怎么办呢？,0,,-1
5089267,comment,手机验证过了，是正品。金色的玻璃后盖挺好看的，总体来说是一次比较好的购物体验,5,手机验证过了，是正品。金色的玻璃后盖挺好看的，总体来说是一次比较好的购物体验,0,,-1
5001213,comment,商品目前看来，没有什么大的损坏，但这包装，&ldquo;呵呵的无话可说！&rdquo;,5,商品目前看来，没有什么大的损坏，但这包装，“呵呵的无话可说！”,0,,29
8240587,comment,手机很完美，运行速度没啥说的，待机也米好。,5,手机很完美，运行速度没啥说的，待机也米好。,0,,2
25158905369,comment,货收到，物流很快，手机外观玩好，通话质量还不错，等用一段时间在追评。谢谢商家周末快递。,5,货收到，物流很快，手机外观玩好，通话质量还不错，等用一段时间在追评。谢谢商家周末快递。,0,,7
20349124505,comment,用过Mate8和9，Mate10绝对是Mate系列做工最为惊艳的一款。前脸的边框和黑边大大大幅度收窄，黑边几乎看不到了!这一下就省了我不少吐槽的口水。额头和下巴也收窄不少，整体紧凑了很多。前脸亮屏后，讲真，惊艳!在不同光线下具是流背面的四曲面玻璃，但是确实是个指纹收手感温润，光溢彩，集器，还在是玻璃，一擦就干净了，但是总擦也不是个事儿啊!机器出厂自带屏幕贴膜，透光率和灵敏度不错，但是依旧是指纹收集利器。2.5D屏的原因，沒有贴满，但是防护作用是起到了。前置指纹很好的解决了虚拟按键占用空间的问题，一些手势操作熟悉之后很方便。屏幕整体来说显示效果不错，色彩的还原比较具实，亮度表现也不错。系统是安卓8.0EMUI8.0，很流畅，手机到手之后就收到了系统更新，说是优化了夜拍等，具体沒细看，等待后续体验。整体风格和EMU15系列相似。NPU的加入给Mate10加分不少，但是现在所能表现的地方貌似就是拍照的自动模式选择和优化期待后续的进一步挖掘其学习能力。店家发货速度很快，有问必答，回复专业。?????0,5,用过Mate8和9，Mate10绝对是Mate系列做工最为惊艳的一款。前脸的边框和黑边大大大幅度收窄，黑边几乎看不到了!这一下就省了我不少吐槽的口水。额头和下巴也收窄不少，整体紧凑了很多。前脸亮屏后，讲真，惊艳!在不同光线下具是流背面的四曲面玻璃，但是确实是个指纹收手感温润，光溢彩，集器，还在是玻璃，一擦就干净了，但是总擦也不是个事儿啊!机器出厂自带屏幕贴膜，透光率和灵敏度不错，但是依旧是指纹收集利器。2.5D屏的原因，沒有贴满，但是防护作用是起到了。前置指纹很好的解决了虚拟按键占用空间的问题，一些手势操作熟悉之后很方便。屏幕整体来说显示效果不错，色彩的还原比较具实，亮度表现也不错。系统是安卓8.0EMUI8.0，很流畅，手机到手之后就收到了系统更新，说是优化了夜拍等，具体沒细看，等待后续体验。整体风格和EMU15系列相似。NPU的加入给Mate10加分不少，但是现在所能表现的地方貌似就是拍照的自动模式选择和优化期待后续的进一步挖掘其学习能力。店家发货速度很快，有问必答，回复专业。?????0,0,,-1
5663902,comment,手机性价比蛮高，值得购买。第一次买华为手机，支持国产,5,手机性价比蛮高，值得购买。第一次买华为手机，支持国产,0,,19
11339519481,comment,质量信任华为，华为是最棒的！身边朋友这款手机买了30多个,5,质量信任华为，华为是最棒的！身边朋友这款手机买了30多个,0,,19
5942439,comment,手机名字叫小辣椒，但是体积不小啊，还行，挺好用的，毕竟便宜，就是普通的老年机,5,手机名字叫小辣椒，但是体积不小啊，还行，挺好用的，毕竟便宜，就是普通的老年机,0,,-1
7479912,comment,2018，8月十号，1799拿下，信号电池照相非常好，电池也能用一天，小喇叭一般般，整体非常完美，这手机非常好，以前用小米手机觉得小米系统好，现在华为的系统改的比小米的一样好，,5,2018，8月十号，1799拿下，信号电池照相非常好，电池也能用一天，小喇叭一般般，整体非常完美，这手机非常好，以前用小米手机觉得小米系统好，现在华为的系统改的比小米的一样好，,0,,3
29638202857,comment,非常好，拍摄清晰，重量也特别轻，拿在手里特别合适,5,非常好，拍摄清晰，重量也特别轻，拿在手里特别合适,0,,27
22863264117,comment,没有图片上的好，不是很满意，寄过来像用过一样,5,没有图片上的好，不是很满意，寄过来像用过一样,0,,-1
7534113,comment,充电器给的别人用过的？,1,充电器给的别人用过的？,0,,4
5920651,comment,用了这么久才来评价，电池确实不错，拍照也够清晰。,5,用了这么久才来评价，电池确实不错，拍照也够清晰。,0,,4
12764636413,comment,不错，正品，还送了好多附件，很实惠。,5,不错，正品，还送了好多附件，很实惠。,0,,23
5402840,comment,声音大，外欢也很漂亮，用起很方便，值得购买,5,声音大，外欢也很漂亮，用起很方便，值得购买,0,,22
28082716822,comment,"手机是原装正品，运行快，拍照前置和后置都好看，音质也不错，外观满意，机身握着也舒适，喜欢哦～
客服服务态度不错，给予鼓励！",5,手机是原装正品，运行快，拍照前置和后置都好看，音质也不错，外观满意，机身握着也舒适，喜欢哦～ 客服服务态度不错，给予鼓励！,0,,-1
7437788,comment,"618下单，25号送到，正常是不能给5星的，但考虑到是小米的新品就算了。
上手感受总体良好，属于可接受范围，但是与想象中的还是相差很大。首先是系统的易用性方面，套上保护套后使用全面屏的返回手势时不灵敏，因为保护套的边缘比屏幕高，手指较难接触到屏幕的边缘。其次是屏幕的黑边太大了，光是玻璃屏幕上的黑边就有1mm以上，加上金属中框的宽度足超2mm。最后是屏幕有瑕疵，屏幕上有一个椭圆形的位置应该是没有做到疏水处理，手指触摸划过后就会留下很碍眼的一团白色，这是质量问题，但是估计贴上保护膜或者钢化膜后就不会有这个问题了，请客服送我一块钢化膜吧?",5,618下单，25号送到，正常是不能给5星的，但考虑到是小米的新品就算了。 上手感受总体良好，属于可接受范围，但是与想象中的还是相差很大。首先是系统的易用性方面，套上保护套后使用全面屏的返回手势时不灵敏，因为保护套的边缘比屏幕高，手指较难接触到屏幕的边缘。其次是屏幕的黑边太大了，光是玻璃屏幕上的黑边就有1mm以上，加上金属中框的宽度足超2mm。最后是屏幕有瑕疵，屏幕上有一个椭圆形的位置应该是没有做到疏水处理，手指触摸划过后就会留下很碍眼的一团白色，这是质量问题，但是估计贴上保护膜或者钢化膜后就不会有这个问题了，请客服送我一块钢化膜吧?,0,,-1
25774787882,comment,客服服务很好，买东西就到京东，没有假货。手机用起来挺好的，玩游戏我不卡，就是不知道用久了怎么样，电池掉电不算太快。,5,客服服务很好，买东西就到京东，没有假货。手机用起来挺好的，玩游戏我不卡，就是不知道用久了怎么样，电池掉电不算太快。,0,,-1
8484451,comment,酷派很良心799送软壳和贴膜，耳机，而且抢的32G内存不是64的可惜了，手机比较重，可能是后盖玻璃设计原因，就是电池有点小，这价买到这手机很完美了&hellip;&hellip;第五部酷派了。,5,酷派很良心799送软壳和贴膜，耳机，而且抢的32G内存不是64的可惜了，手机比较重，可能是后盖玻璃设计原因，就是电池有点小，这价买到这手机很完美了……第五部酷派了。,0,,-1
7694047,comment,要够用了，反应很快，唯一不喜欢的就是充电口了，还是老式的单面充电口。其它的还行。,5,要够用了，反应很快，唯一不喜欢的就是充电口了，还是老式的单面充电口。其它的还行。,0,,4
7846413,comment,年度旗舰名不虚传，手机质感一流，黑色相当沉稳。骁龙845 6+256皇帝版，用个三年应该不是问题，手机相机非常给力，自拍自带美颜，省去美化图片一个步骤，没有红外比较遗憾，不过有NFC，出行公交地铁还是相当方便的。手机非常满意，小米加油,5,年度旗舰名不虚传，手机质感一流，黑色相当沉稳。骁龙845 6+256皇帝版，用个三年应该不是问题，手机相机非常给力，自拍自带美颜，省去美化图片一个步骤，没有红外比较遗憾，不过有NFC，出行公交地铁还是相当方便的。手机非常满意，小米加油,0,,0
11107032701,comment,支持小米，京东！买了寄回去老家给老爸的，说很喜,5,支持小米，京东！买了寄回去老家给老爸的，说很喜,0,,0
8239683,comment,挺好没有毛病吃鸡不怎么卡！还可以不过很8x比吃鸡不在一个档次,5,挺好没有毛病吃鸡不怎么卡！还可以不过很8x比吃鸡不在一个档次,0,,-1
25834204287,comment,是正品。良心商家。物美价廉。依然信任京东,5,是正品。良心商家。物美价廉。依然信任京东,0,,8
5853593,comment,买给老爸的，嘴上说着不要，心里还是美滋滋吧。颜色很漂亮，但是没想象中那么商务，有点后悔没买mate。手机自身占用了很大一部分内存，不知道后面会不会越占越大，4个G的运行内存貌似小了点，要打游戏什么的还是买6个G比较好。前摄像头自带美颜功能，后摄像头拍出来的照片太鲜艳了感觉有点失真，后面两个图是照相功能与苹果的对比。不过苹果夜间拍摄模式渣到爆，这款手机有所提升但是稍微过了点，总体还是可以吧，经济允许的话更推荐mate一些,5,买给老爸的，嘴上说着不要，心里还是美滋滋吧。颜色很漂亮，但是没想象中那么商务，有点后悔没买mate。手机自身占用了很大一部分内存，不知道后面会不会越占越大，4个G的运行内存貌似小了点，要打游戏什么的还是买6个G比较好。前摄像头自带美颜功能，后摄像头拍出来的照片太鲜艳了感觉有点失真，后面两个图是照相功能与苹果的对比。不过苹果夜间拍摄模式渣到爆，这款手机有所提升但是稍微过了点，总体还是可以吧，经济允许的话更推荐mate一些,0,,-1
15612619462,comment,手机很不错，外观精美手感也不错，用起来也很流畅,5,手机很不错，外观精美手感也不错，用起来也很流畅,0,,2
5019352,comment,总体来说不错。只是玩游戏偶尔还是有点卡，不知道是网络原因还是什么的，还有就是发热。,5,总体来说不错。只是玩游戏偶尔还是有点卡，不知道是网络原因还是什么的，还有就是发热。,0,,-1
5089275,comment,京东正品和速度没话说，好的很。  7p送给朋友了  然后买了个8p  8p是玻璃的 有点重量，一切都很好。 电池很耐用，有点不耐脏。记得买壳子，别摔了。     支持京东没毛病,5,京东正品和速度没话说，好的很。 7p送给朋友了 然后买了个8p 8p是玻璃的 有点重量，一切都很好。 电池很耐用，有点不耐脏。记得买壳子，别摔了。 支持京东没毛病,0,,-1
5089267,comment,手机很不错 头天晚上下单 第二天就到了 手机正品行货 没有激活 仔细检查了一下 也没有发现被使用的痕迹 原色显示看着很舒服 刚来事把这事忘记了 和其他屏幕一比吓一跳 黄暖屏这么严重 后来想起来把原色显示关掉还是挺正常的 之前一直在纠结7 128g 后来还是决定买新不买旧 64g现在看来应该是够用的 总体来说是一次不错的购物体验 五星好评吧,5,手机很不错 头天晚上下单 第二天就到了 手机正品行货 没有激活 仔细检查了一下 也没有发现被使用的痕迹 原色显示看着很舒服 刚来事把这事忘记了 和其他屏幕一比吓一跳 黄暖屏这么严重 后来想起来把原色显示关掉还是挺正常的 之前一直在纠结7 128g 后来还是决定买新不买旧 64g现在看来应该是够用的 总体来说是一次不错的购物体验 五星好评吧,0,,-1
5001213,comment,用的好好的，坐长途车了想拿出来玩玩结果开机闪了一下屏就没反应了，搞什么鬼，还能退能换么。难不成去修？,1,用的好好的，坐长途车了想拿出来玩玩结果开机闪了一下屏就没反应了，搞什么鬼，还能退能换么。难不成去修？,0,,-1
8240587,comment,昨天早上下的单，今天拿到手，入手感觉很惊艳，握感很棒，做工感觉能和四千元价位的机子打一打，续航也很棒，拍照还在摸索，但第一感官应该还可以，机身比较窄，带上送的保护套也不显得臃肿，隐藏刘海还有一些app没有适配好，但是不影响使用，刚拿到手，对机器还不熟悉，但总体感觉值得这个价，可惜买晚了没得充电宝耳机领,5,昨天早上下的单，今天拿到手，入手感觉很惊艳，握感很棒，做工感觉能和四千元价位的机子打一打，续航也很棒，拍照还在摸索，但第一感官应该还可以，机身比较窄，带上送的保护套也不显得臃肿，隐藏刘海还有一些app没有适配好，但是不影响使用，刚拿到手，对机器还不熟悉，但总体感觉值得这个价，可惜买晚了没得充电宝耳机领,0,,-1
27357030125,comment,太好了，好喜欢,5,太好了，好喜欢,0,,-1
5089253,comment,时隔三年终于又用回iphone了，手机很小巧，但因为是全面屏所以屏幕尺寸挺大的，单手操作也很方便。,5,时隔三年终于又用回iphone了，手机很小巧，但因为是全面屏所以屏幕尺寸挺大的，单手操作也很方便。,0,,6
7283905,comment,"拿回来迫不及待坐在地上拆了，蓝色很好看很好看，粉色的手机有，黑色的手机也有，白色的手机也有，现在正好多了一个蓝色的。优秀
再说说手机，拿回来开机有69的电量，下载了软件，听歌，到下午五点还有十多点，也没有你们说的那么烫，吃饭的时候充好了电，晚上还开热点，跟我弟弟一起打王者，完全无压力，发烫也真的没有那么严重。然后用电的情况也还好，我不是重度使用，只用听音乐和微信，偶尔打打王者，其他的还好。最不喜欢的就是摄像头，真的真的丑，太突出！！！希望买回来的手机壳能救一救。",5,拿回来迫不及待坐在地上拆了，蓝色很好看很好看，粉色的手机有，黑色的手机也有，白色的手机也有，现在正好多了一个蓝色的。优秀 再说说手机，拿回来开机有69的电量，下载了软件，听歌，到下午五点还有十多点，也没有你们说的那么烫，吃饭的时候充好了电，晚上还开热点，跟我弟弟一起打王者，完全无压力，发烫也真的没有那么严重。然后用电的情况也还好，我不是重度使用，只用听音乐和微信，偶尔打打王者，其他的还好。最不喜欢的就是摄像头，真的真的丑，太突出！！！希望买回来的手机壳能救一救。,0,,10
25158905369,comment,发货快物流快,5,发货快物流快,0,,5
20349124505,comment,"终于收到了盼望已久的mate10,包装很严密，盒子也很精致，打开手机试了试比以前的手机快了许多，leika双摄拍出来的照片就是不一样，上网的速度就更不用说了。视频的色彩很自然逼真，不愧为mate系列的旗舰产品。我也想不通这么好的华为为啥那么多人买苹果，而且苹果比mate10贵了好多。对我来说永远支持国货支持华为。总之，非常不错的一次购物，还有很好的赠品，以后还会光顾本店",5,"终于收到了盼望已久的mate10,包装很严密，盒子也很精致，打开手机试了试比以前的手机快了许多，leika双摄拍出来的照片就是不一样，上网的速度就更不用说了。视频的色彩很自然逼真，不愧为mate系列的旗舰产品。我也想不通这么好的华为为啥那么多人买苹果，而且苹果比mate10贵了好多。对我来说永远支持国货支持华为。总之，非常不错的一次购物，还有很好的赠品，以后还会光顾本店",0,,3
5663902,comment,"非常漂亮的7x,抢了三次才抢到非常不容易，黑色的跟本抢不到，真心喜欢，大气，",5,"非常漂亮的7x,抢了三次才抢到非常不容易，黑色的跟本抢不到，真心喜欢，大气，",0,,6
11339519481,comment,当天上午购买，下午就收到了，而且这是我第三次购买这款手机，主要看中它的电池耐用，反应迅速，价格实惠...非常感京东，商家，谢谢你们，下次需要我还是会选它，而且还会大力推荐亲朋好友购买，再次感谢！,5,当天上午购买，下午就收到了，而且这是我第三次购买这款手机，主要看中它的电池耐用，反应迅速，价格实惠...非常感京东，商家，谢谢你们，下次需要我还是会选它，而且还会大力推荐亲朋好友购买，再次感谢！,0,,-1
5942439,comment,第三次购买了，质量不错，很耐用，老人用最好了！！！给个赞！！！,5,第三次购买了，质量不错，很耐用，老人用最好了！！！给个赞！！！,0,,14
7479912,comment,我跟你说呀，这个东西极好，吃鸡党有福了，全特效吃鸡画质爆棚而且一点都不卡，开高倍镜找人一找一个准，发烫不是很烫，你专注打游戏是感觉不到烫的，不存在烫手一说。,5,我跟你说呀，这个东西极好，吃鸡党有福了，全特效吃鸡画质爆棚而且一点都不卡，开高倍镜找人一找一个准，发烫不是很烫，你专注打游戏是感觉不到烫的，不存在烫手一说。,0,,10
29638202857,comment,很漂亮的电话，支持京东，支持国产,5,很漂亮的电话，支持京东，支持国产,0,,13
22863264117,comment,运行还行，没有送礼品，现在用的还可以，后面就不知道啦！,5,运行还行，没有送礼品，现在用的还可以，后面就不知道啦！,0,,-1
7534113,comment,一次买了两部给孩子们用，手机很漂亮，孩子们很喜欢,5,一次买了两部给孩子们用，手机很漂亮，孩子们很喜欢,0,,-1
